Authors,Title,Year,Source title,Volume,Issue,Art. No.,Page start,Page end,Page count,Cited by,DOI,Link
"Abobeih M.H., Randall J., Bradley C.E., Bartling H.P., Bakker M.A., Degen M.J., Markham M., Twitchen D.J., Taminiau T.H.","Atomic-scale imaging of a 27-nuclear-spin cluster using a quantum sensor",2019,"Nature","576","7787",,"411","415",,21,"10.1038/s41586-019-1834-7","https://www.scopus.com/inward/record.uri?eid=2-s2.0-85076901034&doi=10.1038%2fs41586-019-1834-7&partnerID=40&md5=ad52416b03ddf37b0f5dbaa7e62105a2"
"Welker F., Ramos-Madrigal J., Kuhlwilm M., Liao W., Gutenbrunner P., de Manuel M., Samodova D., Mackie M., Allentoft M.E., Bacon A.-M., Collins M.J., Cox J., Lalueza-Fox C., Olsen J.V., Demeter F., Wang W., Marques-Bonet T., Cappellini E.","Enamel proteome shows that Gigantopithecus was an early diverging pongine",2019,"Nature","576","7786",,"262","265",,21,"10.1038/s41586-019-1728-8","https://www.scopus.com/inward/record.uri?eid=2-s2.0-85075192299&doi=10.1038%2fs41586-019-1728-8&partnerID=40&md5=ce214736d1f39034421c5fb02e644679"
"Paik E.Y., Zhang L., Burg G.W., Gogna R., Tutuc E., Deng H.","Interlayer exciton laser of extended spatial coherence in atomically thin heterostructures",2019,"Nature","576","7785",,"80","84",,21,"10.1038/s41586-019-1779-x","https://www.scopus.com/inward/record.uri?eid=2-s2.0-85075480516&doi=10.1038%2fs41586-019-1779-x&partnerID=40&md5=38b241e909a1a853b556f8b2fcd9dc08"
"Ahmad S., Wang B., Walker M.D., Tran H.-K.R., Stogios P.J., Savchenko A., Grant R.A., McArthur A.G., Laub M.T., Whitney J.C.","An interbacterial toxin inhibits target cell growth by synthesizing (p)ppApp",2019,"Nature","575","7784",,"674","678",,21,"10.1038/s41586-019-1735-9","https://www.scopus.com/inward/record.uri?eid=2-s2.0-85074772817&doi=10.1038%2fs41586-019-1735-9&partnerID=40&md5=dfa52ccc6b48a1ba3d8d4decbea0c3a2"
"MacVicar T., Ohba Y., Nolte H., Mayer F.C., Tatsuta T., Sprenger H.-G., Lindner B., Zhao Y., Li J., Bruns C., Krüger M., Habich M., Riemer J., Schwarzer R., Pasparakis M., Henschke S., Brüning J.C., Zamboni N., Langer T.","Lipid signalling drives proteolytic rewiring of mitochondria by YME1L",2019,"Nature","575","7782",,"361","365",,21,"10.1038/s41586-019-1738-6","https://www.scopus.com/inward/record.uri?eid=2-s2.0-85074795588&doi=10.1038%2fs41586-019-1738-6&partnerID=40&md5=966bfe08c934ab235c639ec64d68fd77"
"Kandel Y.P., Qiao H., Fallahi S., Gardner G.C., Manfra M.J., Nichol J.M.","Coherent spin-state transfer via Heisenberg exchange",2019,"Nature","573","7775",,"553","557",,21,"10.1038/s41586-019-1566-8","https://www.scopus.com/inward/record.uri?eid=2-s2.0-85072675744&doi=10.1038%2fs41586-019-1566-8&partnerID=40&md5=f255b3423bdf6ae9565f256dd9ca94a2"
"Chen Z., Zhou C., Yuan X., Xiao S.","Death march of a segmented and trilobate bilaterian elucidates early animal evolution",2019,"Nature","573","7774",,"412","415",,21,"10.1038/s41586-019-1522-7","https://www.scopus.com/inward/record.uri?eid=2-s2.0-85072202874&doi=10.1038%2fs41586-019-1522-7&partnerID=40&md5=51e73ad64faa98f15179aea1a83192ab"
"Gawryluk R.M.R., Tikhonenkov D.V., Hehenberger E., Husnik F., Mylnikov A.P., Keeling P.J.","Non-photosynthetic predators are sister to red algae",2019,"Nature","572","7768",,"240","243",,21,"10.1038/s41586-019-1398-6","https://www.scopus.com/inward/record.uri?eid=2-s2.0-85069481965&doi=10.1038%2fs41586-019-1398-6&partnerID=40&md5=c060a5961dc4b5ffef31e6a537ecbbe9"
"Zhakypov Z., Mori K., Hosoda K., Paik J.","Designing minimal and scalable insect-inspired multi-locomotion millirobots",2019,"Nature","571","7765",,"381","386",,21,"10.1038/s41586-019-1388-8","https://www.scopus.com/inward/record.uri?eid=2-s2.0-85068929124&doi=10.1038%2fs41586-019-1388-8&partnerID=40&md5=5e9d519051d9927423a4373cdb758610"
"Hu P., Chi H.M., DeBacker K.C., Gong X., Keim J.H., Hsu I.T., Snyder S.A.","Quaternary-centre-guided synthesis of complex polycyclic terpenes",2019,"Nature","569","7758",,"703","707",,21,"10.1038/s41586-019-1179-2","https://www.scopus.com/inward/record.uri?eid=2-s2.0-85066272160&doi=10.1038%2fs41586-019-1179-2&partnerID=40&md5=41dbc07d33af328c1baf580795b665d9"
"Xue J.-H., Chen G.-D., Hao F., Chen H., Fang Z., Chen F.-F., Pang B., Yang Q.-L., Wei X., Fan Q.-Q., Xin C., Zhao J., Deng X., Wang B.-A., Zhang X.-J., Chu Y., Tang H., Yin H., Ma W., Chen L., Ding J., Weinhold E., Kohli R.M., Liu W., Zhu Z.-J., Huang K., Tang H., Xu G.-L.","A vitamin-C-derived DNA modification catalysed by an algal TET homologue",2019,"Nature","569","7757",,"581","585",,21,"10.1038/s41586-019-1160-0","https://www.scopus.com/inward/record.uri?eid=2-s2.0-85065258040&doi=10.1038%2fs41586-019-1160-0&partnerID=40&md5=36bfe0e3afbcdfd1a0290b33c08a09e4"
"Mazza S.E., Gazel E., Bizimis M., Moucha R., Béguelin P., Johnson E.A., McAleer R.J., Sobolev A.V.","Sampling the volatile-rich transition zone beneath Bermuda",2019,"Nature","569","7756",,"398","403",,21,"10.1038/s41586-019-1183-6","https://www.scopus.com/inward/record.uri?eid=2-s2.0-85065797577&doi=10.1038%2fs41586-019-1183-6&partnerID=40&md5=9f34a286e3c5d0e0f9caf7e6afb2e04e"
"Brasch J., Goodman K.M., Noble A.J., Rapp M., Mannepalli S., Bahna F., Dandey V.P., Bepler T., Berger B., Maniatis T., Potter C.S., Carragher B., Honig B., Shapiro L.","Visualization of clustered protocadherin neuronal self-recognition complexes",2019,"Nature","569","7755",,"280","283",,21,"10.1038/s41586-019-1089-3","https://www.scopus.com/inward/record.uri?eid=2-s2.0-85064255972&doi=10.1038%2fs41586-019-1089-3&partnerID=40&md5=d7afaec2a63b160a882fabc079cc3551"
"Zhang B., Wang K.B., Wang W., Wang X., Liu F., Zhu J., Shi J., Li L.Y., Han H., Xu K., Qiao H.Y., Zhang X., Jiao R.H., Houk K.N., Liang Y., Tan R.X., Ge H.M.","Enzyme-catalysed [6+4] cycloadditions in the biosynthesis of natural products",2019,"Nature","568","7750",,"122","126",,21,"10.1038/s41586-019-1021-x","https://www.scopus.com/inward/record.uri?eid=2-s2.0-85063933632&doi=10.1038%2fs41586-019-1021-x&partnerID=40&md5=1341c251b86b6ad410656c7580723fa8"
"Zhao Y., Huang G., Wu Q., Wu K., Li R., Lei J., Pan X., Yan N.","Cryo-EM structures of apo and antagonist-bound human Cav3.1",2019,"Nature","576","7787",,"492","497",,20,"10.1038/s41586-019-1801-3","https://www.scopus.com/inward/record.uri?eid=2-s2.0-85076599200&doi=10.1038%2fs41586-019-1801-3&partnerID=40&md5=cf92d368768216080e425eceba9dae8f"
"Wall J.D., Stawiski E.W., Ratan A., Kim H.L., Kim C., Gupta R., Suryamohan K., Gusareva E.S., Purbojati R.W., Bhangale T., Stepanov V., Kharkov V., Schröder M.S., Ramprasad V., Tom J., Durinck S., Bei Q., Li J., Guillory J., Phalke S., Basu A., Stinson J., Nair S., Malaichamy S., Biswas N.K., Chambers J.C., Cheng K.C., George J.T., Khor S.S., Kim J.-I., Cho B., Menon R., Sattibabu T., Bassi A., Deshmukh M., Verma A., Gopalan V., Shin J.-Y., Pratapneni M., Santhosh S., Tokunaga K., Md-Zain B.M., Chan K.G., Parani M., Natarajan P., Hauser M., Allingham R.R., Santiago-Turla C., Ghosh A., Gadde S.G.K., Fuchsberger C., Forer L., Schoenherr S., Sudoyo H., Lansing J.S., Friedlaender J., Koki G., Cox M.P., Hammer M., Karafet T., Ang K.C., Mehdi S.Q., Radha V., Mohan V., Majumder P.P., Seshagiri S., Seo J.-S., Schuster S.C., Peterson A.S., GenomeAsia100K Consortium","The GenomeAsia 100K Project enables genetic discoveries across Asia",2019,"Nature","576","7785",,"106","111",,20,"10.1038/s41586-019-1793-z","https://www.scopus.com/inward/record.uri?eid=2-s2.0-85076121527&doi=10.1038%2fs41586-019-1793-z&partnerID=40&md5=457bab4f1367344c6817dbdbb373a274"
"Kim S.S., Hermundstad A.M., Romani S., Abbott L.F., Jayaraman V.","Generation of stable heading representations in diverse visual scenes",2019,"Nature","576","7785",,"126","131",,20,"10.1038/s41586-019-1767-1","https://www.scopus.com/inward/record.uri?eid=2-s2.0-85075391971&doi=10.1038%2fs41586-019-1767-1&partnerID=40&md5=f5d290946410a1f08939d4419dfb543a"
"Fisher Y.E., Lu J., D’Alessandro I., Wilson R.I.","Sensorimotor experience remaps visual input to a heading-direction network",2019,"Nature","576","7785",,"121","125",,20,"10.1038/s41586-019-1772-4","https://www.scopus.com/inward/record.uri?eid=2-s2.0-85075359709&doi=10.1038%2fs41586-019-1772-4&partnerID=40&md5=e8869050fb3f090460fc547e00068847"
"Woolston C.","PhDs: the tortuous truth",2019,"Nature","575","7782",,"403","406",,20,"10.1038/d41586-019-03459-7","https://www.scopus.com/inward/record.uri?eid=2-s2.0-85074961117&doi=10.1038%2fd41586-019-03459-7&partnerID=40&md5=a615bd9c0f073e5ced44945dac95b6b3"
"Gökçe O., Castonguay S., Temiz Y., Gervais T., Delamarche E.","Self-coalescing flows in microfluidics for pulse-shaped delivery of reagents",2019,"Nature","574","7777",,"228","232",,20,"10.1038/s41586-019-1635-z","https://www.scopus.com/inward/record.uri?eid=2-s2.0-85073121443&doi=10.1038%2fs41586-019-1635-z&partnerID=40&md5=0a7a97d605fc7318b064ef72d1a80963"
"Bhogaraju S., Bonn F., Mukherjee R., Adams M., Pfleiderer M.M., Galej W.P., Matkovic V., Lopez-Mosqueda J., Kalayil S., Shin D., Dikic I.","Inhibition of bacterial ubiquitin ligases by SidJ–calmodulin catalysed glutamylation",2019,"Nature","572","7769",,"382","386",,20,"10.1038/s41586-019-1440-8","https://www.scopus.com/inward/record.uri?eid=2-s2.0-85070293840&doi=10.1038%2fs41586-019-1440-8&partnerID=40&md5=3eebdef8235176c3d679a6871e733575"
"Sobolev A.V., Asafov E.V., Gurenko A.A., Arndt N.T., Batanova V.G., Portnyagin M.V., Garbe-Schönberg D., Wilson A.H., Byerly G.R.","Deep hydrous mantle reservoir provides evidence for crustal recycling before 3.3 billion years ago",2019,"Nature","571","7766",,"555","559",,20,"10.1038/s41586-019-1399-5","https://www.scopus.com/inward/record.uri?eid=2-s2.0-85069497259&doi=10.1038%2fs41586-019-1399-5&partnerID=40&md5=f6df33dff78519abcec7a633315e7f5b"
"Gruber M., Bozic I., Leshchiner I., Livitz D., Stevenson K., Rassenti L., Rosebrock D., Taylor-Weiner A., Olive O., Goyetche R., Fernandes S.M., Sun J., Stewart C., Wong A., Cibulskis C., Zhang W., Reiter J.G., Gerold J.M., Gribben J.G., Rai K.R., Keating M.J., Brown J.R., Neuberg D., Kipps T.J., Nowak M.A., Getz G., Wu C.J.","Growth dynamics in naturally progressing chronic lymphocytic leukaemia",2019,"Nature","570","7762",,"474","479",,20,"10.1038/s41586-019-1252-x","https://www.scopus.com/inward/record.uri?eid=2-s2.0-85066801565&doi=10.1038%2fs41586-019-1252-x&partnerID=40&md5=487ec6c56b2adbf80709645c75a14323"
"Haberle V., Arnold C.D., Pagani M., Rath M., Schernhuber K., Stark A.","Transcriptional cofactors display specificity for distinct types of core promoters",2019,"Nature","570","7759",,"122","126",,20,"10.1038/s41586-019-1210-7","https://www.scopus.com/inward/record.uri?eid=2-s2.0-85065987439&doi=10.1038%2fs41586-019-1210-7&partnerID=40&md5=ae608d48878acb17d9a20ca55066cab4"
"Yaeger C.E., Ringach D.L., Trachtenberg J.T.","Neuromodulatory control of localized dendritic spiking in critical period cortex",2019,"Nature","567","7746",,"100","104",,20,"10.1038/s41586-019-0963-3","https://www.scopus.com/inward/record.uri?eid=2-s2.0-85062586248&doi=10.1038%2fs41586-019-0963-3&partnerID=40&md5=136be55a223fffd9f683d5ef9f81f8cb"
"Ng T.L., Rohac R., Mitchell A.J., Boal A.K., Balskus E.P.","An N-nitrosating metalloenzyme constructs the pharmacophore of streptozotocin",2019,"Nature","566","7742",,"94","99",,20,"10.1038/s41586-019-0894-z","https://www.scopus.com/inward/record.uri?eid=2-s2.0-85061145877&doi=10.1038%2fs41586-019-0894-z&partnerID=40&md5=24ce94b912cce00db68818700c5c0952"
"Pabst C., Higgins R., Goicoechea J.R., Teyssier D., Berne O., Chambers E., Wolfire M., Suri S.T., Guesten R., Stutzki J., Graf U.U., Risacher C., Tielens A.G.G.M.","Disruption of the Orion molecular core 1 by wind from the massive star θ1 Orionis C",2019,"Nature","565","7741",,"618","621",,20,"10.1038/s41586-018-0844-1","https://www.scopus.com/inward/record.uri?eid=2-s2.0-85060916438&doi=10.1038%2fs41586-018-0844-1&partnerID=40&md5=97079ff346f1f4e6ec09b842002858a3"
"Han X., Altegoer F., Steinchen W., Binnebesel L., Schuhmacher J., Glatter T., Giammarinaro P.I., Djamei A., Rensing S.A., Reissmann S., Kahmann R., Bange G.","A kiwellin disarms the metabolic activity of a secreted fungal virulence factor",2019,"Nature","565","7741",,"650","653",,20,"10.1038/s41586-018-0857-9","https://www.scopus.com/inward/record.uri?eid=2-s2.0-85060766782&doi=10.1038%2fs41586-018-0857-9&partnerID=40&md5=5d4f82e5cc355cc81064f412a0e68d27"
"Strickley J.D., Messerschmidt J.L., Awad M.E., Li T., Hasegawa T., Ha D.T., Nabeta H.W., Bevins P.A., Ngo K.H., Asgari M.M., Nazarian R.M., Neel V.A., Jenson A.B., Joh J., Demehri S.","Immunity to commensal papillomaviruses protects against skin cancer",2019,"Nature","575","7783",,"519","522",,19,"10.1038/s41586-019-1719-9","https://www.scopus.com/inward/record.uri?eid=2-s2.0-85074690167&doi=10.1038%2fs41586-019-1719-9&partnerID=40&md5=9a6b1a1e3f676503eab3e68d615fd201"
"Majer O., Liu B., Kreuk L.S.M., Krogan N., Barton G.M.","UNC93B1 recruits syntenin-1 to dampen TLR7 signalling and prevent autoimmunity",2019,"Nature","575","7782",,"366","370",,19,"10.1038/s41586-019-1612-6","https://www.scopus.com/inward/record.uri?eid=2-s2.0-85074214622&doi=10.1038%2fs41586-019-1612-6&partnerID=40&md5=b7e004cfb7c98e427f9f0a0539c771b6"
"Gunawan O., Pae S.R., Bishop D.M., Virgus Y., Noh J.H., Jeon N.J., Lee Y.S., Shao X., Todorov T., Mitzi D.B., Shin B.","Carrier-resolved photo-Hall effect",2019,"Nature","575","7781",,"151","155",,19,"10.1038/s41586-019-1632-2","https://www.scopus.com/inward/record.uri?eid=2-s2.0-85074866221&doi=10.1038%2fs41586-019-1632-2&partnerID=40&md5=b03e2e2c947b469cab4fc827a3e2f869"
"Ombrato L., Nolan E., Kurelac I., Mavousian A., Bridgeman V.L., Heinze I., Chakravarty P., Horswell S., Gonzalez-Gualda E., Matacchione G., Weston A., Kirkpatrick J., Husain E., Speirs V., Collinson L., Ori A., Lee J.-H., Malanchi I.","Metastatic-niche labelling reveals parenchymal cells with stem features",2019,"Nature","572","7771",,"603","608",,19,"10.1038/s41586-019-1487-6","https://www.scopus.com/inward/record.uri?eid=2-s2.0-85071632233&doi=10.1038%2fs41586-019-1487-6&partnerID=40&md5=b771bbde2679de7b0500b7e7714c9213"
"Olin-Sandoval V., Yu J.S.L., Miller-Fleming L., Alam M.T., Kamrad S., Correia-Melo C., Haas R., Segal J., Peña Navarro D.A., Herrera-Dominguez L., Méndez-Lucio O., Vowinckel J., Mülleder M., Ralser M.","Lysine harvesting is an antioxidant strategy and triggers underground polyamine metabolism",2019,"Nature","572","7768",,"249","253",,19,"10.1038/s41586-019-1442-6","https://www.scopus.com/inward/record.uri?eid=2-s2.0-85069928722&doi=10.1038%2fs41586-019-1442-6&partnerID=40&md5=349c7f13519cb59e719aae7fca46e7c1"
"Mathijssen A.J.T.M., Culver J., Bhamla M.S., Prakash M.","Collective intercellular communication through ultra-fast hydrodynamic trigger waves",2019,"Nature","571","7766",,"560","564",,19,"10.1038/s41586-019-1387-9","https://www.scopus.com/inward/record.uri?eid=2-s2.0-85068936541&doi=10.1038%2fs41586-019-1387-9&partnerID=40&md5=8576ab0fe6984fdce4590d7756bee9a4"
"Liu Y., Wang J., Kim S., Sun H., Yang F., Fang Z., Tamura N., Zhang R., Song X., Wen J., Xu B.Z., Wang M., Lin S., Yu Q., Tom K.B., Deng Y., Turner J., Chan E., Jin D., Ritchie R.O., Minor A.M., Chrzan D.C., Scott M.C., Yao J.","Helical van der Waals crystals with discretized Eshelby twist",2019,"Nature","570","7761",,"358","362",,19,"10.1038/s41586-019-1308-y","https://www.scopus.com/inward/record.uri?eid=2-s2.0-85067472294&doi=10.1038%2fs41586-019-1308-y&partnerID=40&md5=c07716b337df7a3987044488652c0fb5"
"Flegontov P., Altınışık N.E., Changmai P., Rohland N., Mallick S., Adamski N., Bolnick D.A., Broomandkhoshbacht N., Candilio F., Culleton B.J., Flegontova O., Friesen T.M., Jeong C., Harper T.K., Keating D., Kennett D.J., Kim A.M., Lamnidis T.C., Lawson A.M., Olalde I., Oppenheimer J., Potter B.A., Raff J., Sattler R.A., Skoglund P., Stewardson K., Vajda E.J., Vasilyev S., Veselovskaya E., Hayes M.G., O’Rourke D.H., Krause J., Pinhasi R., Reich D., Schiffels S.","Palaeo-Eskimo genetic ancestry and the peopling of Chukotka and North America",2019,"Nature","570","7760",,"236","240",,19,"10.1038/s41586-019-1251-y","https://www.scopus.com/inward/record.uri?eid=2-s2.0-85067075462&doi=10.1038%2fs41586-019-1251-y&partnerID=40&md5=1ad0f73ddcee90a9e97b5aac4f397f2e"
"Wang M., O’Connor J.K., Xu X., Zhou Z.","A new Jurassic scansoriopterygid and the loss of membranous wings in theropod dinosaurs",2019,"Nature","569","7755",,"256","259",,19,"10.1038/s41586-019-1137-z","https://www.scopus.com/inward/record.uri?eid=2-s2.0-85065575045&doi=10.1038%2fs41586-019-1137-z&partnerID=40&md5=5a6d8b24d2b3936a2a4e8cc45b0e1a19"
"Saito Y., Li L., Coyaud E., Luna A., Sander C., Raught B., Asara J.M., Brown M., Muthuswamy S.K.","LLGL2 rescues nutrient stress by promoting leucine uptake in ER+ breast cancer",2019,"Nature","569","7755",,"275","279",,19,"10.1038/s41586-019-1126-2","https://www.scopus.com/inward/record.uri?eid=2-s2.0-85064562563&doi=10.1038%2fs41586-019-1126-2&partnerID=40&md5=5d71c429d16a4ac334cbe454035b2e81"
"Verschueren K.H.G., Blanchet C., Felix J., Dansercoer A., De Vos D., Bloch Y., Van Beeumen J., Svergun D., Gutsche I., Savvides S.N., Verstraete K.","Structure of ATP citrate lyase and the origin of citrate synthase in the Krebs cycle",2019,"Nature","568","7753",,"571","575",,19,"10.1038/s41586-019-1095-5","https://www.scopus.com/inward/record.uri?eid=2-s2.0-85063938074&doi=10.1038%2fs41586-019-1095-5&partnerID=40&md5=a64e871d5cd69633c5f63fe505b40bb3"
"Münster S., Jain A., Mietke A., Pavlopoulos A., Grill S.W., Tomancak P.","Attachment of the blastoderm to the vitelline envelope affects gastrulation of insects",2019,"Nature","568","7752",,"395","399",,19,"10.1038/s41586-019-1044-3","https://www.scopus.com/inward/record.uri?eid=2-s2.0-85063639450&doi=10.1038%2fs41586-019-1044-3&partnerID=40&md5=30523b3f54b2c941370006f7bb653ad1"
"Jayakumar R.P., Madhav M.S., Savelli F., Blair H.T., Cowan N.J., Knierim J.J.","Recalibration of path integration in hippocampal place cells",2019,"Nature","566","7745",,"533","537",,19,"10.1038/s41586-019-0939-3","https://www.scopus.com/inward/record.uri?eid=2-s2.0-85062280031&doi=10.1038%2fs41586-019-0939-3&partnerID=40&md5=1dc161fed3207f33824f6936a64a1845"
"Baek J., Lee S., Cho T., Kim S.-W., Kim M., Yoon Y., Kim K.K., Byun J., Kim S.J., Jeong J., Shin H.-S.","Neural circuits underlying a psychotherapeutic regimen for fear disorders",2019,"Nature","566","7744",,"339","343",,19,"10.1038/s41586-019-0931-y","https://www.scopus.com/inward/record.uri?eid=2-s2.0-85061770073&doi=10.1038%2fs41586-019-0931-y&partnerID=40&md5=e9bfddeb9ead555dd6ebec769731108d"
"Famelis N., Rivera-Calzada A., Degliesposti G., Wingender M., Mietrach N., Skehel J.M., Fernandez-Leiro R., Böttcher B., Schlosser A., Llorca O., Geibel S.","Architecture of the mycobacterial type VII secretion system",2019,"Nature","576","7786",,"321","325",,18,"10.1038/s41586-019-1633-1","https://www.scopus.com/inward/record.uri?eid=2-s2.0-85074668843&doi=10.1038%2fs41586-019-1633-1&partnerID=40&md5=035eaa99b14f894512430084804b0097"
"Hoshino A., Wang W.-J., Wada S., McDermott-Roe C., Evans C.S., Gosis B., Morley M.P., Rathi K.S., Li J., Li K., Yang S., McManus M.J., Bowman C., Potluri P., Levin M., Damrauer S., Wallace D.C., Holzbaur E.L.F., Arany Z.","The ADP/ATP translocase drives mitophagy independent of nucleotide exchange",2019,"Nature","575","7782",,"375","379",,18,"10.1038/s41586-019-1667-4","https://www.scopus.com/inward/record.uri?eid=2-s2.0-85074839514&doi=10.1038%2fs41586-019-1667-4&partnerID=40&md5=2256392c4a9a2058d1ec8e134b92ec27"
"Bashford-Rogers R.J.M., Bergamaschi L., McKinney E.F., Pombal D.C., Mescia F., Lee J.C., Thomas D.C., Flint S.M., Kellam P., Jayne D.R.W., Lyons P.A., Smith K.G.C.","Analysis of the B cell receptor repertoire in six immune-mediated diseases",2019,"Nature","574","7776",,"122","126",,18,"10.1038/s41586-019-1595-3","https://www.scopus.com/inward/record.uri?eid=2-s2.0-85072943493&doi=10.1038%2fs41586-019-1595-3&partnerID=40&md5=7279a103eaa1ff3f1c2b232b05a7932b"
"Miniutti G., Saxton R.D., Giustini M., Alexander K.D., Fender R.P., Heywood I., Monageng I., Coriat M., Tzioumis A.K., Read A.M., Knigge C., Gandhi P., Pretorius M.L., Agís-González B.","Nine-hour X-ray quasi-periodic eruptions from a low-mass black hole galactic nucleus",2019,"Nature","573","7774",,"381","384",,18,"10.1038/s41586-019-1556-x","https://www.scopus.com/inward/record.uri?eid=2-s2.0-85072509403&doi=10.1038%2fs41586-019-1556-x&partnerID=40&md5=c229175dd6c55891c6b23e24648e7d0c"
"Masuda T., Yoshimi A., Fujieda A., Fujimoto H., Haba H., Hara H., Hiraki T., Kaino H., Kasamatsu Y., Kitao S., Konashi K., Miyamoto Y., Okai K., Okubo S., Sasao N., Seto M., Schumm T., Shigekawa Y., Suzuki K., Stellmer S., Tamasaku K., Uetake S., Watanabe M., Watanabe T., Yasuda Y., Yamaguchi A., Yoda Y., Yokokita T., Yoshimura M., Yoshimura K.","X-ray pumping of the 229Th nuclear clock isomer",2019,"Nature","573","7773",,"238","242",,18,"10.1038/s41586-019-1542-3","https://www.scopus.com/inward/record.uri?eid=2-s2.0-85072099405&doi=10.1038%2fs41586-019-1542-3&partnerID=40&md5=765f5cf4cb528cc851ec78f48df475a7"
"Debruyne D.N., Dries R., Sengupta S., Seruggia D., Gao Y., Sharma B., Huang H., Moreau L., McLane M., Day D.S., Marco E., Chen T., Gray N.S., Wong K.-K., Orkin S.H., Yuan G.-C., Young R.A., George R.E.","BORIS promotes chromatin regulatory interactions in treatment-resistant cancer cells",2019,"Nature","572","7771",,"676","680",,18,"10.1038/s41586-019-1472-0","https://www.scopus.com/inward/record.uri?eid=2-s2.0-85070313356&doi=10.1038%2fs41586-019-1472-0&partnerID=40&md5=dada5fad4bdc6e645d6d73c997e58a23"
"Locke A.E., Steinberg K.M., Chiang C.W.K., Service S.K., Havulinna A.S., Stell L., Pirinen M., Abel H.J., Chiang C.C., Fulton R.S., Jackson A.U., Kang C.J., Kanchi K.L., Koboldt D.C., Larson D.E., Nelson J., Nicholas T.J., Pietilä A., Ramensky V., Ray D., Scott L.J., Stringham H.M., Vangipurapu J., Welch R., Yajnik P., Yin X., Eriksson J.G., Ala-Korpela M., Järvelin M.-R., Männikkö M., Laivuori H., Dutcher S.K., Stitziel N.O., Wilson R.K., Hall I.M., Sabatti C., Palotie A., Salomaa V., Laakso M., Ripatti S., Boehnke M., Freimer N.B., FinnGen Project","Exome sequencing of Finnish isolates enhances rare-variant association power",2019,"Nature","572","7769",,"323","328",,18,"10.1038/s41586-019-1457-z","https://www.scopus.com/inward/record.uri?eid=2-s2.0-85069957792&doi=10.1038%2fs41586-019-1457-z&partnerID=40&md5=f3863cf953b99330d0a6b12e559885ef"
"Lu Y., Zhang S., Zhang K., Chen W., Shen Y., Zhang J., Zhang J.-N., Kim K.","Global entangling gates on arbitrary ion qubits",2019,"Nature","572","7769",,"363","367",,18,"10.1038/s41586-019-1428-4","https://www.scopus.com/inward/record.uri?eid=2-s2.0-85069722157&doi=10.1038%2fs41586-019-1428-4&partnerID=40&md5=4169a06cd1c99119f0799d18102a52b2"
"Church S.H., Donoughe S., de Medeiros B.A.S., Extavour C.G.","Insect egg size and shape evolve with ecology but not developmental rate",2019,"Nature","571","7763",,"58","62",,18,"10.1038/s41586-019-1302-4","https://www.scopus.com/inward/record.uri?eid=2-s2.0-85068421680&doi=10.1038%2fs41586-019-1302-4&partnerID=40&md5=057d87d83b3e2b886a27c3c1882ab797"
"Campbell E.C., Wilson E.A., Moore G.W.K., Riser S.C., Brayton C.E., Mazloff M.R., Talley L.D.","Antarctic offshore polynyas linked to Southern Hemisphere climate anomalies",2019,"Nature","570","7761",,"319","325",,18,"10.1038/s41586-019-1294-0","https://www.scopus.com/inward/record.uri?eid=2-s2.0-85067237186&doi=10.1038%2fs41586-019-1294-0&partnerID=40&md5=f571ec3d0154b98238c15818626d5b6f"
"Yeung L.Y., Murray L.T., Martinerie P., Witrant E., Hu H., Banerjee A., Orsi A., Chappellaz J.","Isotopic constraint on the twentieth-century increase in tropospheric ozone",2019,"Nature","570","7760",,"224","227",,18,"10.1038/s41586-019-1277-1","https://www.scopus.com/inward/record.uri?eid=2-s2.0-85067306590&doi=10.1038%2fs41586-019-1277-1&partnerID=40&md5=684b785b7ab6b68432858f1a7dd328d4"
"Pandey S., Mas H., Drougakis G., Thekkeppatt P., Bolpasi V., Vasilakis G., Poulios K., von Klitzing W.","Hypersonic Bose–Einstein condensates in accelerator rings",2019,"Nature","570","7760",,"205","209",,18,"10.1038/s41586-019-1273-5","https://www.scopus.com/inward/record.uri?eid=2-s2.0-85067059166&doi=10.1038%2fs41586-019-1273-5&partnerID=40&md5=7306631d329ce1f9b1f73c0aae8caa6d"
"DeSalvo B.J., Patel K., Cai G., Chin C.","Observation of fermion-mediated interactions between bosonic atoms",2019,"Nature","568","7750",,"61","64",,18,"10.1038/s41586-019-1055-0","https://www.scopus.com/inward/record.uri?eid=2-s2.0-85063951740&doi=10.1038%2fs41586-019-1055-0&partnerID=40&md5=c8181b2d0a2ffc703922c4330eadca36"
"Herold S., Kalb J., Büchel G., Ade C.P., Baluapuri A., Xu J., Koster J., Solvie D., Carstensen A., Klotz C., Rodewald S., Schülein-Völk C., Dobbelstein M., Wolf E., Molenaar J., Versteeg R., Walz S., Eilers M.","Recruitment of BRCA1 limits MYCN-driven accumulation of stalled RNA polymerase",2019,"Nature","567","7749",,"545","549",,18,"10.1038/s41586-019-1030-9","https://www.scopus.com/inward/record.uri?eid=2-s2.0-85063257982&doi=10.1038%2fs41586-019-1030-9&partnerID=40&md5=256a5cc1ca907c4047b3a90ca0778b4a"
"Ramirez C., Hauser A.D., Vucic E.A., Bar-Sagi D.","Plasma membrane V-ATPase controls oncogenic RAS-induced macropinocytosis",2019,"Nature","576","7787",,"477","481",,17,"10.1038/s41586-019-1831-x","https://www.scopus.com/inward/record.uri?eid=2-s2.0-85076434634&doi=10.1038%2fs41586-019-1831-x&partnerID=40&md5=f9053b08f7e6c42235f76dfa246fe5d5"
