Authors,Title,Year,Source title,Volume,Issue,Art. No.,Page start,Page end,Page count,Cited by,DOI,Link
"Wohlfahrt T., Rauber S., Uebe S., Luber M., Soare A., Ekici A., Weber S., Matei A.-E., Chen C.-W., Maier C., Karouzakis E., Kiener H.P., Pachera E., Dees C., Beyer C., Daniel C., Gelse K., Kremer A.E., Naschberger E., Stürzl M., Butter F., Sticherling M., Finotto S., Kreuter A., Kaplan M.H., Jüngel A., Gay S., Nutt S.L., Boykin D.W., Poon G.M.K., Distler O., Schett G., Distler J.H.W., Ramming A.","PU.1 controls fibroblast polarization and tissue fibrosis",2019,"Nature","566","7744",,"344","349",,37,"10.1038/s41586-019-0896-x","https://www.scopus.com/inward/record.uri?eid=2-s2.0-85061807223&doi=10.1038%2fs41586-019-0896-x&partnerID=40&md5=1ed02a68a326b1034d5a8b043f7b8c7f"
"Laughlin T.G., Bayne A.N., Trempe J.-F., Savage D.F., Davies K.M.","Structure of the complex I-like molecule NDH of oxygenic photosynthesis",2019,"Nature","566","7744",,"411","414",,37,"10.1038/s41586-019-0921-0","https://www.scopus.com/inward/record.uri?eid=2-s2.0-85061772215&doi=10.1038%2fs41586-019-0921-0&partnerID=40&md5=01315d24ae1294fbf433f7405a276030"
"Baser A., Skabkin M., Kleber S., Dang Y., Gülcüler Balta G.S., Kalamakis G., Göpferich M., Ibañez D.C., Schefzik R., Lopez A.S., Bobadilla E.L., Schultz C., Fischer B., Martin-Villalba A.","Onset of differentiation is post-transcriptionally controlled in adult neural stem cells",2019,"Nature","566","7742",,"100","104",,37,"10.1038/s41586-019-0888-x","https://www.scopus.com/inward/record.uri?eid=2-s2.0-85061091263&doi=10.1038%2fs41586-019-0888-x&partnerID=40&md5=7fc07db2ad60faf7f80286f76f2eed3c"
"Ringeard M., Marchand V., Decroly E., Motorin Y., Bennasser Y.","FTSJ3 is an RNA 2′-O-methyltransferase recruited by HIV to avoid innate immune sensing",2019,"Nature","565","7740",,"500","504",,37,"10.1038/s41586-018-0841-4","https://www.scopus.com/inward/record.uri?eid=2-s2.0-85060403391&doi=10.1038%2fs41586-018-0841-4&partnerID=40&md5=eccb55af0b51d7c0865a01f3e2fd4680"
"McComas D.J., Christian E.R., Cohen C.M.S., Cummings A.C., Davis A.J., Desai M.I., Giacalone J., Hill M.E., Joyce C.J., Krimigis S.M., Labrador A.W., Leske R.A., Malandraki O., Matthaeus W.H., McNutt R.L., Jr., Mewaldt R.A., Mitchell D.G., Posner A., Rankin J.S., Roelof E.C., Schwadron N.A., Stone E.C., Szalay J.R., Wiedenbeck M.E., Bale S.D., Kasper J.C., Case A.W., Korreck K.E., MacDowall R.J., Pulupa M., Stevens M.L., Rouillard A.P.","Probing the energetic particle environment near the Sun",2019,"Nature","576","7786",,"223","227",,36,"10.1038/s41586-019-1811-1","https://www.scopus.com/inward/record.uri?eid=2-s2.0-85075953771&doi=10.1038%2fs41586-019-1811-1&partnerID=40&md5=7a276372d3cf0490c833f62240d87f56"
"Acciari V.A., Ansoldi S., Antonelli L.A., Arbet Engels A., Baack D., Babić A., Banerjee B., Barres de Almeida U., Barrio J.A., Becerra González J., Bednarek W., Bellizzi L., Bernardini E., Berti A., Besenrieder J., Bhattacharyya W., Bigongiari C., Biland A., Blanch O., Bonnoli G., Bošnjak Ž., Busetto G., Carosi A., Carosi R., Ceribella G., Chai Y., Chilingaryan A., Cikota S., Colak S.M., Colin U., Colombo E., Contreras J.L., Cortina J., Covino S., D’Amico G., D’Elia V., Da Vela P., Dazzi F., De Angelis A., De Lotto B., Delfino M., Delgado J., Depaoli D., Di Pierro F., Di Venere L., Do Souto Espiñeira E., Dominis Prester D., Donini A., Dorner D., Doro M., Elsaesser D., Fallah Ramazani V., Fattorini A., Fernández-Barral A., Ferrara G., Fidalgo D., Foffano L., Fonseca M.V., Font L., Fruck C., Fukami S., Gallozzi S., García López R.J., Garczarczyk M., Gasparyan S., Gaug M., Giglietto N., Giordano F., Godinović N., Green D., Guberman D., Hadasch D., Hahn A., Herrera J., Hoang J., Hrupec D., Hütten M., Inada T., Inoue S., Ishio K., Iwamura Y., Jouvin L., Kerszberg D., Kubo H., Kushida J., Lamastra A., Lelas D., Leone F., Lindfors E., Lombardi S., Longo F., López M., López-Coto R., López-Oramas A., Loporchio S., Machado de Oliveira Fraga B., Maggio C., Majumdar P., Makariev M., Mallamaci M., Maneva G., Manganaro M., Mannheim K., Maraschi L., Mariotti M., Martínez M., Masuda S., Mazin D., Mićanović S., Miceli D., Minev M., Miranda J.M., Mirzoyan R., Molina E., Moralejo A., Morcuende D., Moreno V., Moretti E., Munar-Adrover P., Neustroev V., Nigro C., Nilsson K., Ninci D., Nishijima K., Noda K., Nogués L., Nöthe M., Nozaki S., Paiano S., Palacio J., Palatiello M., Paneque D., Paoletti R., Paredes J.M., Peñil P., Peresano M., Persic M., Prada Moroni P.G., Prandini E., Puljak I., Rhode W., Ribó M., Rico J., Righi C., Rugliancich A., Saha L., Sahakyan N., Saito T., Sakurai S., Satalecka K., Schmidt K., Schweizer T., Sitarek J., Šnidarić I., Sobczynska D., Somero A., Stamerra A., Strom D., Strzys M., Suda Y., Surić T., Takahashi M., Tavecchio F., Temnikov P., Terzić T., Teshima M., Torres-Albà N., Tosti L., Tsujimoto S., Vagelli V., van Scherpenberg J., Vanzo G., Vazquez Acosta M., Vigorito C.F., Vitale V., Vovk I., Will M., Zarić D., Nava L., MAGIC Collaboration","Teraelectronvolt emission from the γ-ray burst GRB 190114C",2019,"Nature","575","7783",,"455","458",,36,"10.1038/s41586-019-1750-x","https://www.scopus.com/inward/record.uri?eid=2-s2.0-85075355530&doi=10.1038%2fs41586-019-1750-x&partnerID=40&md5=4bdfd3f00004fbf57ee7f68b78373926"
"Yu Y., Ma L., Cai P., Zhong R., Ye C., Shen J., Gu G.D., Chen X.H., Zhang Y.","High-temperature superconductivity in monolayer Bi2Sr2CaCu2O8+δ",2019,"Nature","575","7781",,"156","163",,36,"10.1038/s41586-019-1718-x","https://www.scopus.com/inward/record.uri?eid=2-s2.0-85074841935&doi=10.1038%2fs41586-019-1718-x&partnerID=40&md5=78f467982fc38fa4d345bd31ef9d15b4"
"Burstein R., Henry N.J., Collison M.L., Marczak L.B., Sligar A., Watson S., Marquez N., Abbasalizad-Farhangi M., Abbasi M., Abd-Allah F., Abdoli A., Abdollahi M., Abdollahpour I., Abdulkader R.S., Abrigo M.R.M., Acharya D., Adebayo O.M., Adekanmbi V., Adham D., Afshari M., Aghaali M., Ahmadi K., Ahmadi M., Ahmadpour E., Ahmed R., Akal C.G., Akinyemi J.O., Alahdab F., Alam N., Alamene G.M., Alene K.A., Alijanzadeh M., Alinia C., Alipour V., Aljunid S.M., Almalki M.J., Al-Mekhlafi H.M., Altirkawi K., Alvis-Guzman N., Amegah A.K., Amini S., Amit A.M.L., Anbari Z., Androudi S., Anjomshoa M., Ansari F., Antonio C.A.T., Arabloo J., Arefi Z., Aremu O., Armoon B., Arora A., Artaman A., Asadi A., Asadi-Aliabadi M., Ashraf-Ganjouei A., Assadi R., Ataeinia B., Atre S.R., Quintanilla B.P.A., Ayanore M.A., Azari S., Babaee E., Babazadeh A., Badawi A., Bagheri S., Bagherzadeh M., Baheiraei N., Balouchi A., Barac A., Bassat Q., Baune B.T., Bayati M., Bedi N., Beghi E., Behzadifar M., Behzadifar M., Belay Y.B., Bell B., Bell M.L., Berbada D.A., Bernstein R.S., Bhattacharjee N.V., Bhattarai S., Bhutta Z.A., Bijani A., Bohlouli S., Breitborde N.J.K., Britton G., Browne A.J., Nagaraja S.B., Busse R., Butt Z.A., Car J., Cárdenas R., Castañeda-Orjuela C.A., Cerin E., Chanie W.F., Chatterjee P., Chu D.-T., Cooper C., Costa V.M., Dalal K., Dandona L., Dandona R., Daoud F., Daryani A., Das Gupta R., Davis I., Davis Weaver N., Davitoiu D.V., De Neve J.-W., Demeke F.M., Demoz G.T., Deribe K., Desai R., Deshpande A., Desyibelew H.D., Dey S., Dharmaratne S.D., Dhimal M., Diaz D., Doshmangir L., Duraes A.R., Dwyer-Lindgren L., Earl L., Ebrahimi R., Ebrahimpour S., Effiong A., Eftekhari A., Ehsani-Chimeh E., El Sayed I., El Sayed Zaki M., El Tantawi M., El-Khatib Z., Emamian M.H., Enany S., Eskandarieh S., Eyawo O., Ezalarab M., Faramarzi M., Fareed M., Faridnia R., Faro A., Fazaeli A.A., Fazlzadeh M., Fentahun N., Fereshtehnejad S.-M., Fernandes J.C., Filip I., Fischer F., Foigt N.A., Foroutan M., Francis J.M., Fukumoto T., Fullman N., Gallus S., Gebre D.G., Gebrehiwot T.T., Gebremeskel G.G., Gessner B.D., Geta B., Gething P.W., Ghadimi R., Ghadiri K., Ghajarzadeh M., Ghashghaee A., Gill P.S., Gill T.K., Golding N., Gomes N.G.M., Gona P.N., Gopalani S.V., Gorini G., Goulart B.N.G., Graetz N., Greaves F., Green M.S., Guo Y., Haj-Mirzaian A., Haj-Mirzaian A., Hall B.J., Hamidi S., Haririan H., Haro J.M., Hasankhani M., Hasanpoor E., Hasanzadeh A., Hassankhani H., Hassen H.Y., Hegazy M.I., Hendrie D., Heydarpour F., Hird T.R., Hoang C.L., Hollerich G., Rad E.H., Hoseini-Ghahfarokhi M., Hossain N., Hosseini M., Hosseinzadeh M., Hostiuc M., Hostiuc S., Househ M., Hsairi M., Ilesanmi O.S., Imani-Nasab M.H., Iqbal U., Irvani S.S.N., Islam N., Islam S.M.S., Jürisson M., Balalami N.J., Jalali A., Javidnia J., Jayatilleke A.U., Jenabi E., Ji J.S., Jobanputra Y.B., Johnson K., Jonas J.B., Shushtari Z.J., Jozwiak J.J., Kabir A., Kahsay A., Kalani H., Kalhor R., Karami M., Karki S., Kasaeian A., Kassebaum N.J., Keiyoro P.N., Kemp G.R., Khabiri R., Khader Y.S., Khafaie M.A., Khan E.A., Khan J., Khan M.S., Khang Y.-H., Khatab K., Khater A., Khater M.M., Khatony A., Khazaei M., Khazaei S., Khazaei-Pool M., Khubchandani J., Kianipour N., Kim Y.J., Kimokoti R.W., Kinyoki D.K., Kisa A., Kisa S., Kolola T., Kosen S., Koul P.A., Koyanagi A., Kraemer M.U.G., Krishan K., Krohn K.J., Kugbey N., Kumar G.A., Kumar M., Kumar P., Kuupiel D., Lacey B., Lad S.D., Lami F.H., Larsson A.O., Lee P.H., Leili M., Levine A.J., Li S., Lim L.-L., Listl S., Longbottom J., Lopez J.C.F., Lorkowski S., Magdeldin S., Abd El Razek H.M., Abd El Razek M.M., Majeed A., Maleki A., Malekzadeh R., Malta D.C., Mamun A.A., Manafi N., Manda A.-L., Mansourian M., Martins-Melo F.R., Masaka A., Massenburg B.B., Maulik P.K., Mayala B.K., Mazidi M., McKee M., Mehrotra R., Mehta K.M., Meles G.G., Mendoza W., Menezes R.G., Meretoja A., Meretoja T.J., Mestrovic T., Miller T.R., Miller-Petrie M.K., Mills E.J., Milne G.J., Mini G.K., Mir S.M., Mirjalali H., Mirrakhimov E.M., Mohamadi E., Mohammad D.K., Darwesh A.M., Mezerji N.M.G., Mohammed A.S., Mohammed S., Mokdad A.H., Molokhia M., Monasta L., Moodley Y., Moosazadeh M., Moradi G., Moradi M., Moradi Y., Moradi-Lakeh M., Moradinazar M., Moraga P., Morawska L., Mosapour A., Mousavi S.M., Mueller U.O., Muluneh A.G., Mustafa G., Nabavizadeh B., Naderi M., Nagarajan A.J., Nahvijou A., Najafi F., Nangia V., Ndwandwe D.E., Neamati N., Negoi I., Negoi R.I., Ngunjiri J.W., Thi Nguyen H.L., Nguyen L.H., Nguyen S.H., Nielsen K.R., Ningrum D.N.A., Nirayo Y.L., Nixon M.R., Nnaji C.A., Nojomi M., Noroozi M., Nosratnejad S., Noubiap J.J., Motlagh S.N., Ofori-Asenso R., Ogbo F.A., Oladimeji K.E., Olagunju A.T., Olfatifar M., Olum S., Olusanya B.O., Oluwasanu M.M., Onwujekwe O.E., Oren E., Ortega-Altamirano D.D.V., Ortiz A., Osarenotor O., Osei F.B., Osgood-Zimmerman A.E., Otstavnov S.S., Owolabi M.O., Mahesh P.A., Pagheh A.S., Pakhale S., Panda-Jonas S., Pandey A., Park E.-K., Parsian H., Pashaei T., Patel S.K., Pepito V.C.F., Pereira A., Perkins S., Pickering B.V., Pilgrim T., Pirestani M., Piroozi B., Pirsaheb M., Plana-Ripoll O., Pourjafar H., Puri P., Qorbani M., Quintana H., Rabiee M., Rabiee N., Radfar A., Rafiei A., Rahim F., Rahimi Z., Rahimi-Movaghar V., Rahimzadeh S., Rajati F., Raju S.B., Ramezankhani A., Ranabhat C.L., Rasella D., Rashedi V., Rawal L., Reiner Jr R.C., Renzaho A.M.N., Rezaei S., Rezapour A., Riahi S.M., Ribeiro A.I., Roever L., Roro E.M., Roser M., Roshandel G., Roshani D., Rostami A., Rubagotti E., Rubino S., Sabour S., Sadat N., Sadeghi E., Saeedi R., Safari Y., Safari-Faramani R., Safdarian M., Sahebkar A., Salahshoor M.R., Salam N., Salamati P., Salehi F., Zahabi S.S., Salimi Y., Salimzadeh H., Salomon J.A., Sambala E.Z., Samy A.M., Santric Milicevic M.M., Jose B.P.S., Saraswathy S.Y.I., Sarmiento-Suárez R., Sartorius B., Sathian B., Saxena S., Sbarra A.N., Schaeffer L.E., Schwebel D.C., Sepanlou S.G., Seyedmousavi S., Shaahmadi F., Shaikh M.A., Shams-Beyranvand M., Shamshirian A., Shamsizadeh M., Sharafi K., Sharif M., Sharif-Alhoseini M., Sharifi H., Sharma J., Sharma R., Sheikh A., Shields C., Shigematsu M., Shiri R., Shiue I., Shuval K., Siddiqi T.J., Silva J.P., Singh J.A., Sinha D.N., Sisay M.M., Sisay S., Sliwa K., Smith D.L., Somayaji R., Soofi M., Soriano J.B., Sreeramareddy C.T., Sudaryanto A., Sufiyan M.B., Sykes B.L., Sylaja P.N., Tabarés-Seisdedos R., Tabb K.M., Tabuchi T., Taveira N., Temsah M.-H., Terkawi A.S., Tessema Z.T., Thankappan K.R., Thirunavukkarasu S., To Q.G., Tovani-Palone M.R., Tran B.X., Tran K.B., Ullah I., Usman M.S., Uthman O.A., Vahedian-Azimi A., Valdez P.R., van Boven J.F.M., Vasankari T.J., Vasseghian Y., Veisani Y., Venketasubramanian N., Violante F.S., Vladimirov S.K., Vlassov V., Vos T., Vu G.T., Vujcic I.S., Waheed Y., Wakefield J., Wang H., Wang Y., Wang Y.-P., Ward J.L., Weintraub R.G., Weldegwergs K.G., Weldesamuel G.T., Westerman R., Wiysonge C.S., Wondafrash D.Z., Woyczynski L., Wu A.-M., Xu G., Yadegar A., Yamada T., Yazdi-Feyzabadi V., Yilgwan C.S., Yip P., Yonemoto N., Lebni J.Y., Younis M.Z., Yousefifard M., Yousof H.-A.S.A., Yu C., Yusefzadeh H., Zabeh E., Moghadam T.Z., Bin Zaman S., Zamani M., Zandian H., Zangeneh A., Zerfu T.A., Zhang Y., Ziapour A., Zodpey S., Murray C.J.L., Hay S.I.","Mapping 123 million neonatal, infant and child deaths between 2000 and 2017",2019,"Nature","574","7778",,"353","358",,36,"10.1038/s41586-019-1545-0","https://www.scopus.com/inward/record.uri?eid=2-s2.0-85073458638&doi=10.1038%2fs41586-019-1545-0&partnerID=40&md5=17a1970c5f10decfd08811677a9ef3e7"
"Kreidberg L., Koll D.D.B., Morley C., Hu R., Schaefer L., Deming D., Stevenson K.B., Dittmann J., Vanderburg A., Berardo D., Guo X., Stassun K., Crossfield I., Charbonneau D., Latham D.W., Loeb A., Ricker G., Seager S., Vanderspek R.","Absence of a thick atmosphere on the terrestrial exoplanet LHS 3844b",2019,"Nature","573","7772",,"87","90",,36,"10.1038/s41586-019-1497-4","https://www.scopus.com/inward/record.uri?eid=2-s2.0-85071137531&doi=10.1038%2fs41586-019-1497-4&partnerID=40&md5=ca93b48dbcb6386852f66595baa2cda2"
"Swatek K.N., Usher J.L., Kueck A.F., Gladkova C., Mevissen T.E.T., Pruneda J.N., Skern T., Komander D.","Insights into ubiquitin chain architecture using Ub-clipping",2019,"Nature","572","7770",,"533","537",,36,"10.1038/s41586-019-1482-y","https://www.scopus.com/inward/record.uri?eid=2-s2.0-85070805944&doi=10.1038%2fs41586-019-1482-y&partnerID=40&md5=be82b1493be454f8a4e246bd18fda493"
"Sarropoulos I., Marin R., Cardoso-Moreira M., Kaessmann H.","Developmental dynamics of lncRNAs across mammalian organs and species",2019,"Nature","571","7766",,"510","514",,36,"10.1038/s41586-019-1341-x","https://www.scopus.com/inward/record.uri?eid=2-s2.0-85068345053&doi=10.1038%2fs41586-019-1341-x&partnerID=40&md5=6b82ee06c91b1f48ceeaeb67377a8d42"
"Nam A.S., Kim K.-T., Chaligne R., Izzo F., Ang C., Taylor J., Myers R.M., Abu-Zeinah G., Brand R., Omans N.D., Alonso A., Sheridan C., Mariani M., Dai X., Harrington E., Pastore A., Cubillos-Ruiz J.R., Tam W., Hoffman R., Rabadan R., Scandura J.M., Abdel-Wahab O., Smibert P., Landau D.A.","Somatic mutations and cell identity linked by Genotyping of Transcriptomes",2019,"Nature","571","7765",,"355","360",,36,"10.1038/s41586-019-1367-0","https://www.scopus.com/inward/record.uri?eid=2-s2.0-85068540502&doi=10.1038%2fs41586-019-1367-0&partnerID=40&md5=0ad5d90104e87fc232f9888eae48cf27"
"Extance A.","The reality behind solar power's next star material",2019,"Nature","570","7762",,"429","432",,36,"10.1038/d41586-019-01985-y","https://www.scopus.com/inward/record.uri?eid=2-s2.0-85068823455&doi=10.1038%2fd41586-019-01985-y&partnerID=40&md5=29c7eeb36313295b92132170bc1b3e00"
"Ellis S.J., Gomez N.C., Levorse J., Mertz A.F., Ge Y., Fuchs E.","Distinct modes of cell competition shape mammalian tissue morphogenesis",2019,"Nature","569","7757",,"497","502",,36,"10.1038/s41586-019-1199-y","https://www.scopus.com/inward/record.uri?eid=2-s2.0-85065974287&doi=10.1038%2fs41586-019-1199-y&partnerID=40&md5=0cca36c77ee6b9fc86d95e24e98ee6bf"
"Huang T., Lin S.-H., Malewicz N.M., Zhang Y., Zhang Y., Goulding M., LaMotte R.H., Ma Q.","Identifying the pathways required for coping behaviours associated with sustained pain",2019,"Nature","565","7737",,"86","90",,36,"10.1038/s41586-018-0793-8","https://www.scopus.com/inward/record.uri?eid=2-s2.0-85059498650&doi=10.1038%2fs41586-018-0793-8&partnerID=40&md5=350fd45642f857c8e5099b48290ac12a"
"Argelaguet R., Clark S.J., Mohammed H., Stapel L.C., Krueger C., Kapourani C.-A., Imaz-Rosshandler I., Lohoff T., Xiang Y., Hanna C.W., Smallwood S., Ibarra-Soria X., Buettner F., Sanguinetti G., Xie W., Krueger F., Göttgens B., Rugg-Gunn P.J., Kelsey G., Dean W., Nichols J., Stegle O., Marioni J.C., Reik W.","Multi-omics profiling of mouse gastrulation at single-cell resolution",2019,"Nature","576","7787",,"487","491",,35,"10.1038/s41586-019-1825-8","https://www.scopus.com/inward/record.uri?eid=2-s2.0-85076568486&doi=10.1038%2fs41586-019-1825-8&partnerID=40&md5=46184912c8e9abf2598120ae56bf175c"
"Barthel F.P., Johnson K.C., Varn F.S., Moskalik A.D., Tanner G., Kocakavuk E., Anderson K.J., Abiola O., Aldape K., Alfaro K.D., Alpar D., Amin S.B., Ashley D.M., Bandopadhayay P., Barnholtz-Sloan J.S., Beroukhim R., Bock C., Brastianos P.K., Brat D.J., Brodbelt A.R., Bruns A.F., Bulsara K.R., Chakrabarty A., Chakravarti A., Chuang J.H., Claus E.B., Cochran E.J., Connelly J., Costello J.F., Finocchiaro G., Fletcher M.N., French P.J., Gan H.K., Gilbert M.R., Gould P.V., Grimmer M.R., Iavarone A., Ismail A., Jenkinson M.D., Khasraw M., Kim H., Kouwenhoven M.C.M., Laviolette P.S., Li M., Lichter P., Ligon K.L., Lowman A.K., Malta T.M., Mazor T., McDonald K.L., Molinaro A.M., Nam D.-H., Nayyar N., Ng H.K., Ngan C.Y., Niclou S.P., Niers J.M., Noushmehr H., Noorbakhsh J., Ormond D.R., Park C.-K., Poisson L.M., Rabadan R., Radlwimmer B., Rao G., Reifenberger G., Sa J.K., Schuster M., Shaw B.L., Short S.C., Sillevis Smitt P.A., Sloan A.E., Smits M., Suzuki H., Tabatabai G., Van Meir E.G., Watts C., Weller M., Wesseling P., Westerman B.A., Widhalm G., Woehrer A., Yung W.K.A., Zadeh G., Huse J.T., de Groot J.F., Stead L.F., Verhaak R.G.W., The Glioma Longitudinal Analysis (GLASS) Consortium","Longitudinal molecular trajectories of diffuse glioma in adults",2019,"Nature","576","7785",,"112","120",,35,"10.1038/s41586-019-1775-1","https://www.scopus.com/inward/record.uri?eid=2-s2.0-85075234677&doi=10.1038%2fs41586-019-1775-1&partnerID=40&md5=000b1e1a91365845fb6a17cd95acf611"
"Inoue D., Chew G.-L., Liu B., Michel B.C., Pangallo J., D’Avino A.R., Hitchman T., North K., Lee S.C.-W., Bitner L., Block A., Moore A.R., Yoshimi A., Escobar-Hoyos L., Cho H., Penson A., Lu S.X., Taylor J., Chen Y., Kadoch C., Abdel-Wahab O., Bradley R.K.","Spliceosomal disruption of the non-canonical BAF complex in cancer",2019,"Nature","574","7778",,"432","436",,35,"10.1038/s41586-019-1646-9","https://www.scopus.com/inward/record.uri?eid=2-s2.0-85073610618&doi=10.1038%2fs41586-019-1646-9&partnerID=40&md5=74872479a3b6d446a9726086f77e9343"
"Burlingame Q., Huang X., Liu X., Jeong C., Coburn C., Forrest S.R.","Intrinsically stable organic solar cells under high-intensity illumination",2019,"Nature","573","7774",,"394","397",,35,"10.1038/s41586-019-1544-1","https://www.scopus.com/inward/record.uri?eid=2-s2.0-85072508678&doi=10.1038%2fs41586-019-1544-1&partnerID=40&md5=c5475ecabf405c10826c2a90264e1167"
"Zhou F., Wang R., Yuan P., Ren Y., Mao Y., Li R., Lian Y., Li J., Wen L., Yan L., Qiao J., Tang F.","Reconstituting the transcriptome and DNA methylome landscapes of human implantation",2019,"Nature","572","7771",,"660","664",,35,"10.1038/s41586-019-1500-0","https://www.scopus.com/inward/record.uri?eid=2-s2.0-85071321792&doi=10.1038%2fs41586-019-1500-0&partnerID=40&md5=21d7fa08f895d90b92eb413c68606fd4"
"Cuthbert M.O., Taylor R.G., Favreau G., Todd M.C., Shamsudduha M., Villholth K.G., MacDonald A.M., Scanlon B.R., Kotchoni D.O.V., Vouillamoz J.-M., Lawson F.M.A., Adjomayi P.A., Kashaigili J., Seddon D., Sorensen J.P.R., Ebrahim G.Y., Owor M., Nyenje P.M., Nazoumou Y., Goni I., Ousmane B.I., Sibanda T., Ascott M.J., Macdonald D.M.J., Agyekum W., Koussoubé Y., Wanke H., Kim H., Wada Y., Lo M.-H., Oki T., Kukuric N.","Observed controls on resilience of groundwater to climate variability in sub-Saharan Africa",2019,"Nature","572","7768",,"230","234",,35,"10.1038/s41586-019-1441-7","https://www.scopus.com/inward/record.uri?eid=2-s2.0-85070382340&doi=10.1038%2fs41586-019-1441-7&partnerID=40&md5=f7db3691fa5c21796915a197aa7c9ca4"
"Lodygin D., Hermann M., Schweingruber N., Flügel-Koch C., Watanabe T., Schlosser C., Merlini A., Körner H., Chang H.-F., Fischer H.J., Reichardt H.M., Zagrebelsky M., Mollenhauer B., Kügler S., Fitzner D., Frahm J., Stadelmann C., Haberl M., Odoardi F., Flügel A.","β-Synuclein-reactive T cells induce autoimmune CNS grey matter degeneration",2019,"Nature","566","7745",,"503","508",,35,"10.1038/s41586-019-0964-2","https://www.scopus.com/inward/record.uri?eid=2-s2.0-85062304049&doi=10.1038%2fs41586-019-0964-2&partnerID=40&md5=f3203345ac3c51bb7eb688ef97855456"
"Mews P., Egervari G., Nativio R., Sidoli S., Donahue G., Lombroso S.I., Alexander D.C., Riesche S.L., Heller E.A., Nestler E.J., Garcia B.A., Berger S.L.","Alcohol metabolism contributes to brain histone acetylation",2019,"Nature","574","7780",,"717","721",,34,"10.1038/s41586-019-1700-7","https://www.scopus.com/inward/record.uri?eid=2-s2.0-85074227228&doi=10.1038%2fs41586-019-1700-7&partnerID=40&md5=c5a72a57847b881e360b6a01f0470b71"
"Koike H., Iwasawa K., Ouchi R., Maezawa M., Giesbrecht K., Saiki N., Ferguson A., Kimura M., Thompson W.L., Wells J.M., Zorn A.M., Takebe T.","Modelling human hepato-biliary-pancreatic organogenesis from the foregut–midgut boundary",2019,"Nature","574","7776",,"112","116",,34,"10.1038/s41586-019-1598-0","https://www.scopus.com/inward/record.uri?eid=2-s2.0-85072942698&doi=10.1038%2fs41586-019-1598-0&partnerID=40&md5=93835dbfcb197f52d73c743a0b5429fd"
"Saligrama N., Zhao F., Sikora M.J., Serratelli W.S., Fernandes R.A., Louis D.M., Yao W., Ji X., Idoyaga J., Mahajan V.B., Steinmetz L.M., Chien Y.-H., Hauser S.L., Oksenberg J.R., Garcia K.C., Davis M.M.","Opposing T cell responses in experimental autoimmune encephalomyelitis",2019,"Nature","572","7770",,"481","487",,34,"10.1038/s41586-019-1467-x","https://www.scopus.com/inward/record.uri?eid=2-s2.0-85070321699&doi=10.1038%2fs41586-019-1467-x&partnerID=40&md5=e8687f1a920b3e05e4107d8183b4c633"
"Holder R.M., Viete D.R., Brown M., Johnson T.E.","Metamorphism and the evolution of plate tectonics",2019,"Nature","572","7769",,"378","381",,34,"10.1038/s41586-019-1462-2","https://www.scopus.com/inward/record.uri?eid=2-s2.0-85070303665&doi=10.1038%2fs41586-019-1462-2&partnerID=40&md5=9a2f053187873b901b41ae84d98a7045"
"Wang T., Schreiber C., Elbaz D., Yoshimura Y., Kohno K., Shu X., Yamaguchi Y., Pannella M., Franco M., Huang J., Lim C.-F., Wang W.-H.","A dominant population of optically invisible massive galaxies in the early Universe",2019,"Nature","572","7768",,"211","214",,34,"10.1038/s41586-019-1452-4","https://www.scopus.com/inward/record.uri?eid=2-s2.0-85070415161&doi=10.1038%2fs41586-019-1452-4&partnerID=40&md5=e3f28c65dde4c47306d83df93d60d9d8"
"Nguyen P.V., Teutsch N.C., Wilson N.P., Kahn J., Xia X., Graham A.J., Kandyba V., Giampietri A., Barinov A., Constantinescu G.C., Yeung N., Hine N.D.M., Xu X., Cobden D.H., Wilson N.R.","Visualizing electrostatic gating effects in two-dimensional heterostructures",2019,"Nature","572","7768",,"220","223",,34,"10.1038/s41586-019-1402-1","https://www.scopus.com/inward/record.uri?eid=2-s2.0-85069540717&doi=10.1038%2fs41586-019-1402-1&partnerID=40&md5=d17ab0fd6c8fc146c3ca70ced88d56a6"
"Burdge K.B., Coughlin M.W., Fuller J., Kupfer T., Bellm E.C., Bildsten L., Graham M.J., Kaplan D.L., Roestel J., Dekany R.G., Duev D.A., Feeney M., Giomi M., Helou G., Kaye S., Laher R.R., Mahabal A.A., Masci F.J., Riddle R., Shupe D.L., Soumagnac M.T., Smith R.M., Szkody P., Walters R., Kulkarni S.R., Prince T.A.","General relativistic orbital decay in a seven-minute-orbital-period eclipsing binary system",2019,"Nature","571","7766",,"528","531",,34,"10.1038/s41586-019-1403-0","https://www.scopus.com/inward/record.uri?eid=2-s2.0-85069717075&doi=10.1038%2fs41586-019-1403-0&partnerID=40&md5=506308ee9cbab5e7990445aac2db4dfb"
"Chowdhry S., Zanca C., Rajkumar U., Koga T., Diao Y., Raviram R., Liu F., Turner K., Yang H., Brunk E., Bi J., Furnari F., Bafna V., Ren B., Mischel P.S.","NAD metabolic dependency in cancer is shaped by gene amplification and enhancer remodelling",2019,"Nature","569","7757",,"570","575",,34,"10.1038/s41586-019-1150-2","https://www.scopus.com/inward/record.uri?eid=2-s2.0-85064738377&doi=10.1038%2fs41586-019-1150-2&partnerID=40&md5=157308d430f878cf17675579c95f0c59"
"Zhang Y., Cheng T.C., Huang G., Lu Q., Surleac M.D., Mandell J.D., Pontarotti P., Petrescu A.J., Xu A., Xiong Y., Schatz D.G.","Transposon molecular domestication and the evolution of the RAG recombinase",2019,"Nature","569","7754",,"79","84",,34,"10.1038/s41586-019-1093-7","https://www.scopus.com/inward/record.uri?eid=2-s2.0-85064220743&doi=10.1038%2fs41586-019-1093-7&partnerID=40&md5=7c6a0467f558698f6a03892824d9be44"
"Nardou R., Lewis E.M., Rothhaas R., Xu R., Yang A., Boyden E., Dölen G.","Oxytocin-dependent reopening of a social reward learning critical period with MDMA",2019,"Nature","569","7754",,"116","120",,34,"10.1038/s41586-019-1075-9","https://www.scopus.com/inward/record.uri?eid=2-s2.0-85063970386&doi=10.1038%2fs41586-019-1075-9&partnerID=40&md5=f5f1bd2eb7cb275a8f04a9b6d21cf98b"
"Owens T.W., Taylor R.J., Pahil K.S., Bertani B.R., Ruiz N., Kruse A.C., Kahne D.","Structural basis of unidirectional export of lipopolysaccharide to the cell surface",2019,"Nature","567","7749",,"550","553",,34,"10.1038/s41586-019-1039-0","https://www.scopus.com/inward/record.uri?eid=2-s2.0-85063273103&doi=10.1038%2fs41586-019-1039-0&partnerID=40&md5=38d387fb7e96265729287baa30049a3c"
