Authors,Title,Year,Source title,Volume,Issue,Art. No.,Page start,Page end,Page count,Cited by,DOI,Link
"Watts M.C., Picco L., Russell-Pavier F.S., Cullen P.L., Miller T.S., Bartuś S.P., Payton O.D., Skipper N.T., Tileli V., Howard C.A.","Production of phosphorene nanoribbons",2019,"Nature","568","7751",,"216","220",,78,"10.1038/s41586-019-1074-x","https://www.scopus.com/inward/record.uri?eid=2-s2.0-85064259924&doi=10.1038%2fs41586-019-1074-x&partnerID=40&md5=a8d8a5339372fc5a1b772c7b35f31518"
"Klompe S.E., Vo P.L.H., Halpin-Healy T.S., Sternberg S.H.","Transposon-encoded CRISPR–Cas systems direct RNA-guided DNA integration",2019,"Nature","571","7764",,"219","225",,77,"10.1038/s41586-019-1323-z","https://www.scopus.com/inward/record.uri?eid=2-s2.0-85068561162&doi=10.1038%2fs41586-019-1323-z&partnerID=40&md5=dd2ed0d0faa5efa997b7e87a0f6cd02c"
"Cook S.J., Jarrell T.A., Brittin C.A., Wang Y., Bloniarz A.E., Yakovlev M.A., Nguyen K.C.Q., Tang L.T.-H., Bayer E.A., Duerr J.S., Bülow H.E., Hobert O., Hall D.H., Emmons S.W.","Whole-animal connectomes of both Caenorhabditis elegans sexes",2019,"Nature","571","7763",,"63","71",,76,"10.1038/s41586-019-1352-7","https://www.scopus.com/inward/record.uri?eid=2-s2.0-85068393431&doi=10.1038%2fs41586-019-1352-7&partnerID=40&md5=916a2ebb8fe87103a6c2c80ab4107b59"
"Veres A., Faust A.L., Bushnell H.L., Engquist E.N., Kenty J.H.-R., Harb G., Poh Y.-C., Sintov E., Gürtler M., Pagliuca F.W., Peterson Q.P., Melton D.A.","Charting cellular identity during human in vitro β-cell differentiation",2019,"Nature","569","7756",,"368","373",,76,"10.1038/s41586-019-1168-5","https://www.scopus.com/inward/record.uri?eid=2-s2.0-85065552049&doi=10.1038%2fs41586-019-1168-5&partnerID=40&md5=23eef52aa2a516372e7bd7d880f0768b"
"Kandala A., Temme K., Córcoles A.D., Mezzacapo A., Chow J.M., Gambetta J.M.","Error mitigation extends the computational reach of a noisy quantum processor",2019,"Nature","567","7749",,"491","495",,76,"10.1038/s41586-019-1040-7","https://www.scopus.com/inward/record.uri?eid=2-s2.0-85063638310&doi=10.1038%2fs41586-019-1040-7&partnerID=40&md5=ecd7f4802814af859c3e5d5acaa5f2ec"
"Chen F., Welker F., Shen C.-C., Bailey S.E., Bergmann I., Davis S., Xia H., Wang H., Fischer R., Freidline S.E., Yu T.-L., Skinner M.M., Stelzer S., Dong G., Fu Q., Dong G., Wang J., Zhang D., Hublin J.-J.","A late Middle Pleistocene Denisovan mandible from the Tibetan Plateau",2019,"Nature","569","7756",,"409","412",,75,"10.1038/s41586-019-1139-x","https://www.scopus.com/inward/record.uri?eid=2-s2.0-85065224605&doi=10.1038%2fs41586-019-1139-x&partnerID=40&md5=9d7d00b0b1aeb422f7da4b55391f1b47"
"Mateo L.J., Murphy S.E., Hafner A., Cinquini I.S., Walker C.A., Boettiger A.N.","Visualizing DNA folding and RNA in embryos at single-cell resolution",2019,"Nature","568","7750",,"49","54",,75,"10.1038/s41586-019-1035-4","https://www.scopus.com/inward/record.uri?eid=2-s2.0-85063931612&doi=10.1038%2fs41586-019-1035-4&partnerID=40&md5=40a8b4dc8fea1eb248d3a97cef8b7234"
"Sanchez D.S., Belopolski I., Cochran T.A., Xu X., Yin J.-X., Chang G., Xie W., Manna K., Süß V., Huang C.-Y., Alidoust N., Multer D., Zhang S.S., Shumiya N., Wang X., Wang G.-Q., Chang T.-R., Felser C., Xu S.-Y., Jia S., Lin H., Hasan M.Z.","Topological chiral crystals with helicoid-arc quantum states",2019,"Nature","567","7749",,"500","505",,75,"10.1038/s41586-019-1037-2","https://www.scopus.com/inward/record.uri?eid=2-s2.0-85063290284&doi=10.1038%2fs41586-019-1037-2&partnerID=40&md5=3e0693f007e4ca51b7e04c65e59ef576"
"Rao Z., Li H., Zhang T., Tian S., Li C., Fu B., Tang C., Wang L., Li Z., Fan W., Li J., Huang Y., Liu Z., Long Y., Fang C., Weng H., Shi Y., Lei H., Sun Y., Qian T., Ding H.","Observation of unconventional chiral fermions with long Fermi arcs in CoSi",2019,"Nature","567","7749",,"496","499",,75,"10.1038/s41586-019-1031-8","https://www.scopus.com/inward/record.uri?eid=2-s2.0-85063288116&doi=10.1038%2fs41586-019-1031-8&partnerID=40&md5=2cd1b9c4d1b04e8ed816f0fb6ef988e3"
"Briney B., Inderbitzin A., Joyce C., Burton D.R.","Commonality despite exceptional diversity in the baseline human antibody repertoire",2019,"Nature","566","7744",,"393","397",,75,"10.1038/s41586-019-0879-y","https://www.scopus.com/inward/record.uri?eid=2-s2.0-85061783470&doi=10.1038%2fs41586-019-0879-y&partnerID=40&md5=6314565f17aa4a6a5f3da0fd04fd81b1"
"Park S.L., Buzzai A., Rautela J., Hor J.L., Hochheiser K., Effern M., McBain N., Wagner T., Edwards J., McConville R., Wilmott J.S., Scolyer R.A., Tüting T., Palendira U., Gyorki D., Mueller S.N., Huntington N.D., Bedoui S., Hölzel M., Mackay L.K., Waithman J., Gebhardt T.","Tissue-resident memory CD8+ T cells promote melanoma–immune equilibrium in skin",2019,"Nature","565","7739",,"366","371",,75,"10.1038/s41586-018-0812-9","https://www.scopus.com/inward/record.uri?eid=2-s2.0-85060134900&doi=10.1038%2fs41586-018-0812-9&partnerID=40&md5=8a97c4cd3574dce84c325dfe8b1e0469"
"Jafferis N.T., Helbling E.F., Karpelson M., Wood R.J.","Untethered flight of an insect-sized flapping-wing microscale aerial vehicle",2019,"Nature","570","7762",,"491","495",,74,"10.1038/s41586-019-1322-0","https://www.scopus.com/inward/record.uri?eid=2-s2.0-85068905575&doi=10.1038%2fs41586-019-1322-0&partnerID=40&md5=39883737016fd11655fae33218e1e7c1"
"Steidinger B.S., Crowther T.W., Liang J., Van Nuland M.E., Werner G.D.A., Reich P.B., Nabuurs G., de-Miguel S., Zhou M., Picard N., Herault B., Zhao X., Zhang C., Routh D., Peay K.G., Abegg M., Adou Yao C.Y., Alberti G., Almeyda Zambrano A., Alvarez-Davila E., Alvarez-Loayza P., Alves L.F., Ammer C., Antón-Fernández C., Araujo-Murakami A., Arroyo L., Avitabile V., Aymard G., Baker T., Bałazy R., Banki O., Barroso J., Bastian M., Bastin J.-F., Birigazzi L., Birnbaum P., Bitariho R., Boeckx P., Bongers F., Bouriaud O., Brancalion P.H.S., Brandl S., Brearley F.Q., Brienen R., Broadbent E., Bruelheide H., Bussotti F., Cazzolla Gatti R., Cesar R., Cesljar G., Chazdon R., Chen H.Y.H., Chisholm C., Cienciala E., Clark C.J., Clark D., Colletta G., Condit R., Coomes D., Cornejo Valverde F., Corral-Rivas J.J., Crim P., Cumming J., Dayanandan S., de Gasper A.L., Decuyper M., Derroire G., DeVries B., Djordjevic I., Iêda A., Dourdain A., Obiang N.L.E., Enquist B., Eyre T., Fandohan A.B., Fayle T.M., Feldpausch T.R., Finér L., Fischer M., Fletcher C., Fridman J., Frizzera L., Gamarra J.G.P., Gianelle D., Glick H.B., Harris D., Hector A., Hemp A., Hengeveld G., Herbohn J., Herold M., Hillers A., Honorio Coronado E.N., Huber M., Hui C., Cho H., Ibanez T., Jung I., Imai N., Jagodzinski A.M., Jaroszewicz B., Johannsen V., Joly C.A., Jucker T., Karminov V., Kartawinata K., Kearsley E., Kenfack D., Kennard D., Kepfer-Rojas S., Keppel G., Khan M.L., Killeen T., Kim H.S., Kitayama K., Köhl M., Korjus H., Kraxner F., Laarmann D., Lang M., Lewis S., Lu H., Lukina N., Maitner B., Malhi Y., Marcon E., Marimon B.S., Marimon-Junior B.H., Marshall A.R., Martin E., Martynenko O., Meave J.A., Melo-Cruz O., Mendoza C., Merow C., Monteagudo Mendoza A., Moreno V., Mukul S.A., Mundhenk P., Nava-Miranda M.G., Neill D., Neldner V., Nevenic R., Ngugi M., Niklaus P., Oleksyn J., Ontikov P., Ortiz-Malavasi E., Pan Y., Paquette A., Parada-Gutierrez A., Parfenova E., Park M., Parren M., Parthasarathy N., Peri P.L., Pfautsch S., Phillips O., Piedade M.T., Piotto D., Pitman N.C.A., Polo I., Poorter L., Poulsen A.D., Poulsen J.R., Pretzsch H., Ramirez Arevalo F., Restrepo-Correa Z., Rodeghiero M., Rolim S., Roopsind A., Rovero F., Rutishauser E., Saikia P., Saner P., Schall P., Schelhaas M.-J., Schepaschenko D., Scherer-Lorenzen M., Schmid B., Schöngart J., Searle E., Seben V., Serra-Diaz J.M., Salas-Eljatib C., Sheil D., Shvidenko A., Silva-Espejo J., Silveira M., Singh J., Sist P., Slik F., Sonké B., Souza A.F., Stereńczak K., Svenning J.-C., Svoboda M., Targhetta N., Tchebakova N., Steege H., Thomas R., Tikhonova E., Umunay P., Usoltsev V., Valladares F., van der Plas F., Van Do T., Vasquez Martinez R., Verbeeck H., Viana H., Vieira S., von Gadow K., Wang H.-F., Watson J., Westerlund B., Wiser S., Wittmann F., Wortel V., Zagt R., Zawila-Niedzwiecki T., Zhu Z.-X., Zo-Bi I.C., GFBI consortium","Climatic controls of decomposition drive the global biogeography of forest-tree symbioses",2019,"Nature","569","7756",,"404","408",,74,"10.1038/s41586-019-1128-0","https://www.scopus.com/inward/record.uri?eid=2-s2.0-85065790614&doi=10.1038%2fs41586-019-1128-0&partnerID=40&md5=416cf3480d062ff4a1f78b6ccd7cf1c3"
"Pietrzyński G., Graczyk D., Gallenne A., Gieren W., Thompson I.B., Pilecki B., Karczmarek P., Górski M., Suchomska K., Taormina M., Zgirski B., Wielgórski P., Kołaczkowski Z., Konorski P., Villanova S., Nardetto N., Kervella P., Bresolin F., Kudritzki R.P., Storm J., Smolec R., Narloch W.","A distance to the Large Magellanic Cloud that is precise to one per cent",2019,"Nature","567","7747",,"200","203",,74,"10.1038/s41586-019-0999-4","https://www.scopus.com/inward/record.uri?eid=2-s2.0-85062876851&doi=10.1038%2fs41586-019-0999-4&partnerID=40&md5=2627e6b7cfd484738b9693b16305a949"
"Khanday I., Skinner D., Yang B., Mercier R., Sundaresan V.","A male-expressed rice embryogenic trigger redirected for asexual propagation through seeds",2019,"Nature","565","7737",,"91","95",,74,"10.1038/s41586-018-0785-8","https://www.scopus.com/inward/record.uri?eid=2-s2.0-85059019117&doi=10.1038%2fs41586-018-0785-8&partnerID=40&md5=52fadfee0498f7f32f48d02f9d1a38e9"
"Culemann S., Grüneboom A., Nicolás-Ávila J.Á., Weidner D., Lämmle K.F., Rothe T., Quintana J.A., Kirchner P., Krljanac B., Eberhardt M., Ferrazzi F., Kretzschmar E., Schicht M., Fischer K., Gelse K., Faas M., Pfeifle R., Ackermann J.A., Pachowsky M., Renner N., Simon D., Haseloff R.F., Ekici A.B., Bäuerle T., Blasig I.E., Vera J., Voehringer D., Kleyer A., Paulsen F., Schett G., Hidalgo A., Krönke G.","Locally renewing resident synovial macrophages provide a protective barrier for the joint",2019,"Nature","572","7771",,"670","675",,73,"10.1038/s41586-019-1471-1","https://www.scopus.com/inward/record.uri?eid=2-s2.0-85070340683&doi=10.1038%2fs41586-019-1471-1&partnerID=40&md5=8956641fd68c0c35795167222d9ac854"
"Pei J., Deng L., Song S., Zhao M., Zhang Y., Wu S., Wang G., Zou Z., Wu Z., He W., Chen F., Deng N., Wu S., Wang Y., Wu Y., Yang Z., Ma C., Li G., Han W., Li H., Wu H., Zhao R., Xie Y., Shi L.","Towards artificial general intelligence with hybrid Tianjic chip architecture",2019,"Nature","572","7767",,"106","111",,73,"10.1038/s41586-019-1424-8","https://www.scopus.com/inward/record.uri?eid=2-s2.0-85070888097&doi=10.1038%2fs41586-019-1424-8&partnerID=40&md5=50cc13c282f65c5cb8d1fde1f70c6a42"
"Obradović M.M.S., Hamelin B., Manevski N., Couto J.P., Sethi A., Coissieux M.-M., Münst S., Okamoto R., Kohler H., Schmidt A., Bentires-Alj M.","Glucocorticoids promote breast cancer metastasis",2019,"Nature","567","7749",,"540","544",,73,"10.1038/s41586-019-1019-4","https://www.scopus.com/inward/record.uri?eid=2-s2.0-85063633359&doi=10.1038%2fs41586-019-1019-4&partnerID=40&md5=58ecfeb013d752cb57b4e4f600d2c383"
"Zhang C., Zhang Y., Yuan X., Lu S., Zhang J., Narayan A., Liu Y., Zhang H., Ni Z., Liu R., Choi E.S., Suslov A., Sanvito S., Pi L., Lu H.-Z., Potter A.C., Xiu F.","Quantum Hall effect based on Weyl orbits in Cd3As2",2019,"Nature","565","7739",,"331","336",,73,"10.1038/s41586-018-0798-3","https://www.scopus.com/inward/record.uri?eid=2-s2.0-85060168901&doi=10.1038%2fs41586-018-0798-3&partnerID=40&md5=1cafcf9ccdccfeb89e8267e43694f450"
"Larsson A.J.M., Johnsson P., Hagemann-Jensen M., Hartmanis L., Faridani O.R., Reinius B., Segerstolpe Å., Rivera C.M., Ren B., Sandberg R.","Genomic encoding of transcriptional burst kinetics",2019,"Nature","565","7738",,"251","254",,73,"10.1038/s41586-018-0836-1","https://www.scopus.com/inward/record.uri?eid=2-s2.0-85059744150&doi=10.1038%2fs41586-018-0836-1&partnerID=40&md5=b712ae70272c608855f838055d1adeeb"
"Kasper J.C., Bale S.D., Belcher J.W., Berthomier M., Case A.W., Chandran B.D.G., Curtis D.W., Gallagher D., Gary S.P., Golub L., Halekas J.S., Ho G.C., Horbury T.S., Hu Q., Huang J., Klein K.G., Korreck K.E., Larson D.E., Livi R., Maruca B., Lavraud B., Louarn P., Maksimovic M., Martinovic M., McGinnis D., Pogorelov N.V., Richardson J.D., Skoug R.M., Steinberg J.T., Stevens M.L., Szabo A., Velli M., Whittlesey P.L., Wright K.H., Zank G.P., MacDowall R.J., McComas D.J., McNutt R.L., Jr, Pulupa M., Raouafi N.E., Schwadron N.A.","Alfvénic velocity spikes and rotational flows in the near-Sun solar wind",2019,"Nature","576","7786",,"228","231",,72,"10.1038/s41586-019-1813-z","https://www.scopus.com/inward/record.uri?eid=2-s2.0-85075932608&doi=10.1038%2fs41586-019-1813-z&partnerID=40&md5=7f66aecec0b4614017a175270cb0b511"
"Pritchard H.D.","Asia’s shrinking glaciers protect large populations from drought stress",2019,"Nature","569","7758",,"649","654",,72,"10.1038/s41586-019-1240-1","https://www.scopus.com/inward/record.uri?eid=2-s2.0-85066504484&doi=10.1038%2fs41586-019-1240-1&partnerID=40&md5=9c5e84194e55c5196c43c84275980ad9"
"Gabisonia K., Prosdocimo G., Aquaro G.D., Carlucci L., Zentilin L., Secco I., Ali H., Braga L., Gorgodze N., Bernini F., Burchielli S., Collesi C., Zandonà L., Sinagra G., Piacenti M., Zacchigna S., Bussani R., Recchia F.A., Giacca M.","MicroRNA therapy stimulates uncontrolled cardiac repair after myocardial infarction in pigs",2019,"Nature","569","7756",,"418","422",,72,"10.1038/s41586-019-1191-6","https://www.scopus.com/inward/record.uri?eid=2-s2.0-85065544756&doi=10.1038%2fs41586-019-1191-6&partnerID=40&md5=abad76ddac3ede2353deb8c5c0d178dc"
"Serra D., Mayr U., Boni A., Lukonin I., Rempfler M., Challet Meylan L., Stadler M.B., Strnad P., Papasaikas P., Vischi D., Waldt A., Roma G., Liberali P.","Self-organization and symmetry breaking in intestinal organoid development",2019,"Nature","569","7754",,"66","72",,72,"10.1038/s41586-019-1146-y","https://www.scopus.com/inward/record.uri?eid=2-s2.0-85064897604&doi=10.1038%2fs41586-019-1146-y&partnerID=40&md5=87e77005d9b96f1f326cee6a94a93cbb"
"Pluvinage J.V., Haney M.S., Smith B.A.H., Sun J., Iram T., Bonanno L., Li L., Lee D.P., Morgens D.W., Yang A.C., Shuken S.R., Gate D., Scott M., Khatri P., Luo J., Bertozzi C.R., Bassik M.C., Wyss-Coray T.","CD22 blockade restores homeostatic microglial phagocytosis in ageing brains",2019,"Nature","568","7751",,"187","192",,72,"10.1038/s41586-019-1088-4","https://www.scopus.com/inward/record.uri?eid=2-s2.0-85063964083&doi=10.1038%2fs41586-019-1088-4&partnerID=40&md5=fb165ad1fe8bcf8feae00f771c262892"
"Yang Y., Gao Z., Xue H., Zhang L., He M., Yang Z., Singh R., Chong Y., Zhang B., Chen H.","Realization of a three-dimensional photonic topological insulator",2019,"Nature","565","7741",,"622","626",,72,"10.1038/s41586-018-0829-0","https://www.scopus.com/inward/record.uri?eid=2-s2.0-85060931532&doi=10.1038%2fs41586-018-0829-0&partnerID=40&md5=1983e0d4edc8c07c070f643881115be3"
"Liu X., Wang Y., Lu H., Li J., Yan X., Xiao M., Hao J., Alekseev A., Khong H., Chen T., Huang R., Wu J., Zhao Q., Wu Q., Xu S., Wang X., Jin W., Yu S., Wang Y., Wei L., Wang A., Zhong B., Ni L., Liu X., Nurieva R., Ye L., Tian Q., Bian X.-W., Dong C.","Genome-wide analysis identifies NR4A1 as a key mediator of T cell dysfunction",2019,"Nature","567","7749",,"525","529",,71,"10.1038/s41586-019-0979-8","https://www.scopus.com/inward/record.uri?eid=2-s2.0-85062834294&doi=10.1038%2fs41586-019-0979-8&partnerID=40&md5=67e782f541f6f06035dbb9474b42093b"
"Gronke K., Hernández P.P., Zimmermann J., Klose C.S.N., Kofoed-Branzk M., Guendel F., Witkowski M., Tizian C., Amann L., Schumacher F., Glatt H., Triantafyllopoulou A., Diefenbach A.","Interleukin-22 protects intestinal stem cells against genotoxic stress",2019,"Nature","566","7743",,"249","253",,71,"10.1038/s41586-019-0899-7","https://www.scopus.com/inward/record.uri?eid=2-s2.0-85061504994&doi=10.1038%2fs41586-019-0899-7&partnerID=40&md5=d0b351ccfab76daacc4e152eec52cbd1"
"Yadav A.K., Nguyen K.X., Hong Z., García-Fernández P., Aguado-Puente P., Nelson C.T., Das S., Prasad B., Kwon D., Cheema S., Khan A.I., Hu C., Íñiguez J., Junquera J., Chen L.-Q., Muller D.A., Ramesh R., Salahuddin S.","Spatially resolved steady-state negative capacitance",2019,"Nature","565","7740",,"468","471",,71,"10.1038/s41586-018-0855-y","https://www.scopus.com/inward/record.uri?eid=2-s2.0-85060403157&doi=10.1038%2fs41586-018-0855-y&partnerID=40&md5=8cabec6b3ca64c2fc8736352af435920"
"Aykut B., Pushalkar S., Chen R., Li Q., Abengozar R., Kim J.I., Shadaloey S.A., Wu D., Preiss P., Verma N., Guo Y., Saxena A., Vardhan M., Diskin B., Wang W., Leinwand J., Kurz E., Kochen Rossi J.A., Hundeyin M., Zambrinis C., Li X., Saxena D., Miller G.","The fungal mycobiome promotes pancreatic oncogenesis via activation of MBL",2019,"Nature","574","7777",,"264","267",,70,"10.1038/s41586-019-1608-2","https://www.scopus.com/inward/record.uri?eid=2-s2.0-85074201113&doi=10.1038%2fs41586-019-1608-2&partnerID=40&md5=85bf42b260803c649545eafb012248e1"
"Parikh K., Antanaviciute A., Fawkner-Corbett D., Jagielowicz M., Aulicino A., Lagerholm C., Davis S., Kinchen J., Chen H.H., Alham N.K., Ashley N., Johnson E., Hublitz P., Bao L., Lukomska J., Andev R.S., Björklund E., Kessler B.M., Fischer R., Goldin R., Koohy H., Simmons A.","Colonic epithelial cell diversity in health and inflammatory bowel disease",2019,"Nature","567","7746",,"49","55",,70,"10.1038/s41586-019-0992-y","https://www.scopus.com/inward/record.uri?eid=2-s2.0-85062586978&doi=10.1038%2fs41586-019-0992-y&partnerID=40&md5=cbf368010c61c3fbb45850386c270206"
"Yu X., Xie Z., Yu Y., Lee J., Vazquez-Guardado A., Luan H., Ruban J., Ning X., Akhtar A., Li D., Ji B., Liu Y., Sun R., Cao J., Huo Q., Zhong Y., Lee C.M., Kim S.Y., Gutruf P., Zhang C., Xue Y., Guo Q., Chempakasseril A., Tian P., Lu W., Jeong J.Y., Yu Y.J., Cornman J., Tan C.S., Kim B.H., Lee K.H., Feng X., Huang Y., Rogers J.A.","Skin-integrated wireless haptic interfaces for virtual and augmented reality",2019,"Nature","575","7783",,"473","479",,69,"10.1038/s41586-019-1687-0","https://www.scopus.com/inward/record.uri?eid=2-s2.0-85075440196&doi=10.1038%2fs41586-019-1687-0&partnerID=40&md5=1512cfb07a89633a4d6e8949be8ba852"
"Lee-Six H., Olafsson S., Ellis P., Osborne R.J., Sanders M.A., Moore L., Georgakopoulos N., Torrente F., Noorani A., Goddard M., Robinson P., Coorens T.H.H., O’Neill L., Alder C., Wang J., Fitzgerald R.C., Zilbauer M., Coleman N., Saeb-Parsy K., Martincorena I., Campbell P.J., Stratton M.R.","The landscape of somatic mutation in normal colorectal epithelial cells",2019,"Nature","574","7779",,"532","537",,69,"10.1038/s41586-019-1672-7","https://www.scopus.com/inward/record.uri?eid=2-s2.0-85074073382&doi=10.1038%2fs41586-019-1672-7&partnerID=40&md5=c6266d6d7e37ed01fba9c70517b83ebd"
"Vladoiu M.C., El-Hamamy I., Donovan L.K., Farooq H., Holgado B.L., Sundaravadanam Y., Ramaswamy V., Hendrikse L.D., Kumar S., Mack S.C., Lee J.J.Y., Fong V., Juraschka K., Przelicki D., Michealraj A., Skowron P., Luu B., Suzuki H., Morrissy A.S., Cavalli F.M.G., Garzia L., Daniels C., Wu X., Qazi M.A., Singh S.K., Chan J.A., Marra M.A., Malkin D., Dirks P., Heisler L., Pugh T., Ng K., Notta F., Thompson E.M., Kleinman C.L., Joyner A.L., Jabado N., Stein L., Taylor M.D.","Childhood cerebellar tumours mirror conserved fetal transcriptional programs",2019,"Nature","572","7767",,"67","73",,69,"10.1038/s41586-019-1158-7","https://www.scopus.com/inward/record.uri?eid=2-s2.0-85065246071&doi=10.1038%2fs41586-019-1158-7&partnerID=40&md5=ac814d7498ff3cc78e27f59d0be12c08"
"Jonsson P., Bandlamudi C., Cheng M.L., Srinivasan P., Chavan S.S., Friedman N.D., Rosen E.Y., Richards A.L., Bouvier N., Selcuklu S.D., Bielski C.M., Abida W., Mandelker D., Birsoy O., Zhang L., Zehir A., Donoghue M.T.A., Baselga J., Offit K., Scher H.I., O’Reilly E.M., Stadler Z.K., Schultz N., Socci N.D., Viale A., Ladanyi M., Robson M.E., Hyman D.M., Berger M.F., Solit D.B., Taylor B.S.","Tumour lineage shapes BRCA-mediated phenotypes",2019,"Nature","571","7766",,"576","579",,69,"10.1038/s41586-019-1382-1","https://www.scopus.com/inward/record.uri?eid=2-s2.0-85068928418&doi=10.1038%2fs41586-019-1382-1&partnerID=40&md5=5a92b9ff23988f15ea1e071b3461f06a"
"Lustig E., Weimann S., Plotnik Y., Lumer Y., Bandres M.A., Szameit A., Segev M.","Photonic topological insulator in synthetic dimensions",2019,"Nature","567","7748",,"356","360",,69,"10.1038/s41586-019-0943-7","https://www.scopus.com/inward/record.uri?eid=2-s2.0-85062839594&doi=10.1038%2fs41586-019-0943-7&partnerID=40&md5=3a5a2def83189571eee8b0d57bfd00e1"
"Berger F., Plutschack M.B., Riegger J., Yu W., Speicher S., Ho M., Frank N., Ritter T.","Site-selective and versatile aromatic C−H functionalization by thianthrenation",2019,"Nature","567","7747",,"223","228",,69,"10.1038/s41586-019-0982-0","https://www.scopus.com/inward/record.uri?eid=2-s2.0-85062852792&doi=10.1038%2fs41586-019-0982-0&partnerID=40&md5=a90d0acdf4220bceeb7023698ac893ca"
"Lee J.W., Stone M.L., Porrett P.M., Thomas S.K., Komar C.A., Li J.H., Delman D., Graham K., Gladney W.L., Hua X., Black T.A., Chien A.L., Majmundar K.S., Thompson J.C., Yee S.S., O’Hara M.H., Aggarwal C., Xin D., Shaked A., Gao M., Liu D., Borad M.J., Ramanathan R.K., Carpenter E.L., Ji A., de Beer M.C., de Beer F.C., Webb N.R., Beatty G.L.","Hepatocytes direct the formation of a pro-metastatic niche in the liver",2019,"Nature","567","7747",,"249","252",,69,"10.1038/s41586-019-1004-y","https://www.scopus.com/inward/record.uri?eid=2-s2.0-85062691344&doi=10.1038%2fs41586-019-1004-y&partnerID=40&md5=022bc8b2ae75ecc8f86b3dd280c1226d"
"Ma Q., Xu S.-Y., Shen H., MacNeill D., Fatemi V., Chang T.-R., Mier Valdivia A.M., Wu S., Du Z., Hsu C.-H., Fang S., Gibson Q.D., Watanabe K., Taniguchi T., Cava R.J., Kaxiras E., Lu H.-Z., Lin H., Fu L., Gedik N., Jarillo-Herrero P.","Observation of the nonlinear Hall effect under time-reversal-symmetric conditions",2019,"Nature","565","7739",,"337","342",,69,"10.1038/s41586-018-0807-6","https://www.scopus.com/inward/record.uri?eid=2-s2.0-85060176578&doi=10.1038%2fs41586-018-0807-6&partnerID=40&md5=0a5bf140df87bbc1b2463911fcd70729"
"Lynn R.C., Weber E.W., Sotillo E., Gennert D., Xu P., Good Z., Anbunathan H., Lattin J., Jones R., Tieu V., Nagaraja S., Granja J., de Bourcy C.F.A., Majzner R., Satpathy A.T., Quake S.R., Monje M., Chang H.Y., Mackall C.L.","c-Jun overexpression in CAR T cells induces exhaustion resistance",2019,"Nature","576","7786",,"293","300",,68,"10.1038/s41586-019-1805-z","https://www.scopus.com/inward/record.uri?eid=2-s2.0-85075931233&doi=10.1038%2fs41586-019-1805-z&partnerID=40&md5=524908e6732209e42cd67ab10f3e4046"
"Manoli G., Fatichi S., Schläpfer M., Yu K., Crowther T.W., Meili N., Burlando P., Katul G.G., Bou-Zeid E.","Magnitude of urban heat islands largely explained by climate and population",2019,"Nature","573","7772",,"55","60",,68,"10.1038/s41586-019-1512-9","https://www.scopus.com/inward/record.uri?eid=2-s2.0-85071774373&doi=10.1038%2fs41586-019-1512-9&partnerID=40&md5=d2a2c5da0d4c6b129c63e58073df4fb1"
"Einzinger M., Wu T., Kompalla J.F., Smith H.L., Perkinson C.F., Nienhaus L., Wieghold S., Congreve D.N., Kahn A., Bawendi M.G., Baldo M.A.","Sensitization of silicon by singlet exciton fission in tetracene",2019,"Nature","571","7763",,"90","94",,68,"10.1038/s41586-019-1339-4","https://www.scopus.com/inward/record.uri?eid=2-s2.0-85069268011&doi=10.1038%2fs41586-019-1339-4&partnerID=40&md5=4c9625ddae0c47e8644508b860be2ee6"
"Rogers K., Kelleway J.J., Saintilan N., Megonigal J.P., Adams J.B., Holmquist J.R., Lu M., Schile-Beers L., Zawadzki A., Mazumder D., Woodroffe C.D.","Wetland carbon storage controlled by millennial-scale variation in relative sea-level rise",2019,"Nature","567","7746",,"91","95",,68,"10.1038/s41586-019-0951-7","https://www.scopus.com/inward/record.uri?eid=2-s2.0-85062585818&doi=10.1038%2fs41586-019-0951-7&partnerID=40&md5=4b44efb7fab903f4cd8991016a2c167d"
"Boers N., Goswami B., Rheinwalt A., Bookhagen B., Hoskins B., Kurths J.","Complex networks reveal global pattern of extreme-rainfall teleconnections",2019,"Nature","566","7744",,"373","377",,68,"10.1038/s41586-018-0872-x","https://www.scopus.com/inward/record.uri?eid=2-s2.0-85061777459&doi=10.1038%2fs41586-018-0872-x&partnerID=40&md5=4bf07b5e39e8585fea1c9ca37a59f15f"
"Monahan K., Horta A., Lomvardas S.","LHX2- and LDB1-mediated trans interactions regulate olfactory receptor choice",2019,"Nature","565","7740",,"448","453",,68,"10.1038/s41586-018-0845-0","https://www.scopus.com/inward/record.uri?eid=2-s2.0-85060371794&doi=10.1038%2fs41586-018-0845-0&partnerID=40&md5=a5b7a14e7e8e8c1acf32d06c6c93ffef"
"Zhang R.K., Chen K., Huang X., Wohlschlager L., Renata H., Arnold F.H.","Enzymatic assembly of carbon–carbon bonds via iron-catalysed sp 3 C–H functionalization",2019,"Nature","565","7737",,"67","72",,68,"10.1038/s41586-018-0808-5","https://www.scopus.com/inward/record.uri?eid=2-s2.0-85059499533&doi=10.1038%2fs41586-018-0808-5&partnerID=40&md5=3572eebf648bdfa20c95619ee2d3a6da"
"Ayyaz A., Kumar S., Sangiorgi B., Ghoshal B., Gosio J., Ouladan S., Fink M., Barutcu S., Trcka D., Shen J., Chan K., Wrana J.L., Gregorieff A.","Single-cell transcriptomes of the regenerating intestine reveal a revival stem cell",2019,"Nature","569","7754",,"121","125",,67,"10.1038/s41586-019-1154-y","https://www.scopus.com/inward/record.uri?eid=2-s2.0-85064915073&doi=10.1038%2fs41586-019-1154-y&partnerID=40&md5=4623df5daf82343ea13add08eae39a19"
